අපේ පරම පිවිතුරු මෙව්ව එකට එව්ව මෙව්ව කියන්නෙපා හරිද එරංග බ්‍රෝස් 🤨,0
"මා සිතනා පරිදි මෙය ""නිසිපරිදි ලිංගිකව එක්වීම"" ලෙස සංස්කරණය විය යුතුයි. නැතිනම් දූෂණය කිරීම වැනි මානසික අසහන",0
ලොල් රන්බණ්ඩා...උඹ මේක දැක්කෙ නැද්ද ?,0
දැන් ඒකි ඔය කරේ තියන් යන හාමු එලිපිට අහුවෙලා තියෙන්නෙ නුවර කේස් එකට 😂,1
මම නම් කියන්නේ බයිට් වැඩ සටහන් තිබ්බට කමක් නෑ. හැබැයි සීමාව දැනගත යුතුයි. මිනිස්සුන්ගේ ආත්මගරුත්වයට හානි කරලා,0
තොපිට හම්බෙයි බලා ඉදහල්ලා...තොපි වගේ අවලං බල්ලො එනකං තමයි ඒ පළාත් වල ඡන්ද දායකයො බලාන ඉන්නෙ...කාලා වරෙල්ලා...,1
අම්මටසිරි එහෙම සීන් එකකුත් උනාද? 😂,0
ඇයි දේශපාලුවෝ ටික ??? උන් හොයන්නේ,0
8 සමත් වීර සංගිලි පනික්කියො...පව් නොදී ව්‍යාඝ්‍රා පැකට් එකක් ගෙදරින් තියලා වරෙන්...නැත්තං ගේ වටේ පොඩි කොල්ලො මැරෙයි...,1
😂😂😂😜 අපිට තේරෙනවනේ බන් මිනිස්සු හැරෙනකොට 👊,0
එහෙම ආගම ගැන හිතුවනම් අද හින්දි සිනමාවක් නැතිතරම්. ශාරුක් ඛාන්,0
නෙදකින්..ගමරාළයා දිවේ නොගෑවී බොරු කෙළින ලස්සන,1
ඇයි හිටියෙ නැත්නම් මහරගම සුදු මල්ලිද සුදු අයියද ලව්ව මට ගස්සන්නද? 😏,1
ජීවත්වීමේ වාසනාවේ උපරිමය​. සැමදෙනාම වාසනාවන්තයි බොලව් ඒ වෙලාවේ...,0
දැන් ඉතින් පොහොට්ටුවට බඩු පැකට් වෙලා ඉවරයි...පිපෙන්නත් කලින්ම පොහොට්ටුව කුණු උනා...,1
උඹ වගේ ගඳ ගහන ගූ බාල්දියක් නම් පැනල දෙන්න ඕන නෑ,1
පාප් වහන්සේ ආප්පයක් කයි වගේ ළඟදිම​. මේපාර කතෝලික ආගමටත් මඩ පාරවල් ටිකක් කන්න වෙන සීන් එකක් තියෙන්නේ.,1
මේ අපරාධය කරපු කාලකන්නියට නැවත මිනිස් ආත්මයක් නම් නොලැබේවා...,1
ආ තව උබේ මොන්ගල් හූඇන්පී සෙට් එකටයි,1
ඇත්ත බන්. අපේ රටේ මිනිස්සුන්ගේ ඔලුව හදන්න ඕනේ සේරටම කලින්. ඒකට මහා සංඝයා හරියට ඉන්නත් ඕනේ. දැන් මහණවුනු ගොඩක් අය හොරු. ඒ චීවරධාරීන් හඳුනාගන්න,1
මූට දැන් පපුවෙ අමාරු නැද්ද...දැක්කත් අප්පිරියයි මේ නරකාදි ගෙබි මූණා...,1
ඔව් උබට විතරයි,0
මේකේ තියෙන්නේ ලංකා හොස්පිටල් එකේදී බද්ධ කිරීම කරගන්න පුළුවන් කියලා නේද​? ඉතින් ඒකෙන් කියවෙනවද එම රෝහලේ වකුගඩු විකුණනවා කියලා???? ඉන්දියන් කාරයෝ කපටි නිසා වකුගඩු විකුණලා ලංකාවෙදී පරිත්‍යාග කරපු විදිහට බද්ධ කරවනවා ඇති. ඒකේදී රෝහලට වැරද්දක් කියන්න බෑ. ලංකා හොස්පිටල් එකේ ගොඩක් ඉන්දියානු වෛද්‍යවරු ඉන්නේ. ඉතින් උන් එක්ක සම්බන්ධ වෙලා මොනවහරි කරනවද කියන්නනම් දන්නේ නෑ.,0
මෝඩ තකතීරු ගමරාළයෙක් ජනාධිපතිකරලා ලංකාවෙ මිනිස්සු මදැයි කොලා....,1
ඒකනේ අපි එයාව උඩ දාල ජනතාව දැනුවත් කරන්නේ 😜,0
චෝගම් චෝගම් කිය කියා රටේ සල්ලි පොදි ගණන් ආණ්ඩුවෙන් විනාස කරනවා. යටි මඩි ගහනවා. ඒ කොහොමින් කොහොම හරි රටට ලෝක ප්‍රජාවගෙන් ලැබෙනවා. ලොකු අවධානයක් දිනා ගෙන තියෙනවා. ඒත් ඒ අතරේ මහින්ද මහත්තයා චැනල් 4 වලට පවා එන්න කියලා ලකුණු දාගන්න අතරේ අනෙක් පැත්තෙන් ඒවාට කපටි ලෙස විරෝධය පාන්න ආණ්ඩුව සූක්‍ෂ්හම වෙලා තියෙනවා.,1
කවදාහරි මැරුන දවසක පෙරේතයෙක් වෙන්න පුලුවන්...ඒ නිසා කරුණාකරලා දැන්වත් ගෙදර ගිහින් පිනක් දහමක් කරගෙන දූෂිත දශකයේ කරපු පව් කන්දරාවෙන් ගොඩ යන්න බලන්න.,1
ආ....නේ....එයා වහුකුණ කිව්ව එකත් භාර අරන්දැ? 🤣🤣🤣🔫🔫🔫,0
හැබැයි විපක්‍ෂය රටේ විපක්‍ෂයද කියලා දැන් ආයෙත් හිතන්න වෙලා. යූ එන් පී සමහර අය යුද්ධේ කාලේ රට පාවාදෙන්න හැදුවා වගේ දැන් ආයෙත් පටන් අරන්. චැනල් 4 එකට මොංගල් සමරවීර රටේ නිදහස නෑ කියලා. උන් ඇහුවලු එහෙනම් මෙහෙම මාධ්‍ය සාකච්ඡාවක් තිබ්බේ කොහොමද කියලා. මෙන්න මොඞලයා කියනවලු මාධ්‍ය සාකච්ඡා තියන්න පුළුවන් වුනාට ඒවා ප්‍රචාරය වෙන්නේ නෑ කියලා. මිනිස්සු වෙනුවෙන් කට අරින්නේ නැති මුන් මේ වෙලාවේ රටට එන යම් පිළිගැනීම හරි නැති කරන එක ගැනත් දාමුකෝ ගොසිප්පෝ. එක පැත්තකින් ආණ් ඩුව මහජන මුදල් විනාශ කරද්දි,1
මේ පිස්සු හටනට කණට දෙකක් දීලා ලංකාව බේරගන්න කෙනෙක් නැද්ද...ගමරාළයගෙ දැන් නම් ඔලුව හොදටම කචල් වගේ...තව ටික දවසක් ගියොත් මේ මනුස්සයා පිස්සෙක් වෙන එක වෙනවාමයි...ලොල් බන්දුල පෙරේරා...මේ ඔබ වෙත කරනා සිහිකැඳවීමක් බව සිතනු හොඳා...,1
මං මේ කල්පනා කලේ......🤔 පනිට්ටුව පෙන්නුව විතරයි ඒකි කඹෙත් බැඳන් ඇඳගෙනත් නාල ඉවරනේ දැන් රෙදිත් හෝදනවලු 🤣 🤣 🤣,1
ගොසිප්පෝ. ඉස්සෙල්ලා ලියලා තිබ්බා,0
ඇත්තම කථාව මේකිට දැන් හාන්සි උනත් කවුරුවත් වැඩක් දෙන්නෙ නෑ...තම්බපු ඉස්සා වගේ වෙලා ඉන්ජෙක්ෂන් ගහලා...ලිලියන් එදිරිසිංහ ගානටම මහත් වෙලා...මේ වගේ උන්ට කවුද බං නිළියො කියන්නෙ...නිළිකමේ වැඩ නැති වෙනකොට ජීවත් වෙන්න ක්‍රමයක් විදියට තමයි දේශපාලනයට එන්නෙ...උඹලා වගේ දේශපාලන දර්ශනයක් නැති,1
ඒකි හිතන් ඇත්තේ අපිට පුපේ ඉත්තෑවෝ දුවනව කියලද දන්නෑ ෆේක් වලින් හරි ගිහින් එව්ව බලන්න 😂,1
මේකාගේ කුකුළ් කම කෙසේවෙතත් වාචාල කමනම් තියෙනවා. මට පේන්නේ මූ ඡන්දේ ඉල්ලලා තියෙන්නේ බඩු ගහන්නද කොහෙද​. හැබැයි ඉතින් කරන එකා කියවන්නේ නෑ. කියවන එකා කියන තරම් කරන්නේ නෑ. මේක ඇවිල්ලා තමන් විසින්ම කියවගෙන ගෑණුන් අද්දවා ගන්න ක්‍රමයක්. හරියට අර කැම්පස් යන කාලේ කවුද මන්දා තමන් කැමති කෙල්ලට කැමත්ත ගන්න හැංගිලා,1
අනේ කරුනා කරලා උබ කොහෙට හරි අපනයනය වෙයන් හතුරො. අපිට දැන් දැන් පේන්න තියෙන විදියට ලන්කාවෙ ක්‍රිකට් වල හතුරා උබ....උබ යද්දි යෝගට් මෙන්ඩිස් වත් අරගෙන පලයන්,1
මිනිහට කාර් එකක් නැත්නම් බඩ වෙන්න බෑ කිව්ව ගෑණිට උඹේ කකුල මොකක්ද? 🤣,1
සිරා කතාව​. මම අත්දැකීමෙන් දැකලා තියෙනවා සත්තු මරණ උන් විඳවල මැරෙන හැටි. එතකොට ඔය එක දෙවියෙක්වත් ඌව විඳවීමෙන් වලක්වන්න නෑ.,0
මූට දැන් තියෙන්නෙ පත්තරේ නවත්තලා රේස් කොල අච්චු ගහන්න,0
උඹටත් හරිද දිසා?? 😂😂😂,0
මාස දෙකකට දවස් කීයක් තියෙනවද මචන්ලා ??? දන්න කෙනෙක් ඉන්නවනම් මේකට රිප්ලයි එකක් දාපන් බන්.,0
රුසියන් නංගි කෙනෙක්නෙ...සෝයි නේද...,0
මගේ කකුල කැඩුනා තමයි ඔයා මට කකුල තිබ්බ කාලෙත් කරේ ඔහොමමනේ චූටි නංගී. ගියසැරේ කැන්ඩි මීටප් එකෙන් පස්සෙ ගෑනු කියන කථා නෙමෙයි…,0
මොකද අපේ මහරජා හමුදුරුවන්ට පොරොන්දු උනාවගේ මතකයි මාස දෙකකින් ගවඝාතනය තහනම් කරනවා කියලා.,0
කෝටි 16 න් ගියත්...ත්‍රී වීල් එකෙන් ගියත් යන්නෙ එකම පාරෙ නෙ බං...කවදාහරි දවසක ඕකත් දිරලා වල පල්ලට යනවා...කෝටි 16 කින් කරන්න තව වැඩ කොච්චර නම් තියේද...,1
මුන්ට කියනවනම් බැරියැ,0
"ඔබටත් ආශ්චර්‍යමත් රටක පොහොසත් වී ජීවත් වීමට අවශ්‍යද​???,",0
"මේ පහරදීම මම අනුමත කරන්නෙ නෑ...ධීවර සොයුරු ඇන්තනීට වෙඩි වදින කොට,",0
"ඒ ගැනනම් කතා කරල වැඩක් නෑ 😂 ,",0
"ආණ්ඩු පක්‍ෂයෙන් ඡන්දේ ඉල්ලලා බලයට පත්වෙන්න​. කෙටිකාලීනව ප්‍රබල දේශපාලකයන්ට සහ ජනපති ඇතුළු පවුලට අසීමිතව කඩේ යාමට සිදුවුවත්,",1
"පර්සියට කඩේ ගිහින් පස්ස බිම ඇණ ගත්ත...තමන් හැම දේම දන්නවා කියලා ඔලුව ඉදිමුන මරි මෝඩ ගවයෙක් මූ...තැටිය රත් වෙච්ච වෙලේ රොටිය පුච්චගන්න...හිට්ස් හොයාගෙන පොර ටෝක් දෙන ලද බොලද පිංපොං....උඹ වගේ උන්ට අනුකම්පා නොකර වෙන මොනවා කරන්නද...,",1
"මහ එකාට හපන් මුන් කටු කන එකාලා 😂 ,",1
උපුටා ගැනීම : මහින්ද චින්තනය​ - සුබ අනාගතයක්.,0
මල් ගහන උන්ම තමයි ඉතිං...මල් ගහන එකාගෙ අවශ්‍යතාව දන්නෙ...ඔය කියලා තියෙන්නෙ ඉහළින්ම.,0
දැක්කත් අප්පිරියත් මූසල යක්කු ටික. සල්ලි වලට කඩේ යන්න හැත්ත,1
මාගේ මෙම කොමෙන්ට් එක නැත​. මා දන්නා පරිදි අපේ ගොසිප්පා කිසිම කොමෙන්ටුවක් කපාහරින්නේ නැත​. මීට කලින් එසේ සිදුවීද නැත​. නමුත්,0
ඇතුලට ගියාම හැදෙන මුගෙ පපුවෙ අමාරුව දැන් හොදද ? තූ නෙදකින් දැක්කත් අප්පිරියයි,1
ඔව් මං දැක්කා ආයේ කුලී කාරයෝ ටික එක්ක එකතු වෙලා උඩ දදා යනෝ. බලු බෙටි ටික බලු බෙටි ගොඩටම සෙට් වෙන හැටි 😅,1
ඔබටත් ආශ්චර්‍යමත් රටක පොහොසත් වී ජීවත් වීමට අවශ්‍යද​???,0
මේකත් ෂුවර් එකටම ඉරාජයගෙම වැඩක්...ඔයා යකා තරම් කුප්ප යකෙක් මම තවත් දැකලා නෑ,1
අනේ මන්ද බ්‍රෝ. මං ඉතින් ඔව්ව ගණන් තියන් ඉන්න එකක් කියල යෑ. අනික උන්ගෙන් මං කාල අඳිනව කියල යෑ???? 🤣 🤣 🤣,0
ආණ්ඩු පක්‍ෂයෙන් ඡන්දේ ඉල්ලලා බලයට පත්වෙන්න​. කෙටිකාලීනව ප්‍රබල දේශපාලකයන්ට සහ ජනපති ඇතුළු පවුලට අසීමිතව කඩේ යාමට සිදුවුවත්,1
පර්සිගේ තිර රචනය අන්තිමයි. මීට වඩා තාත්විකව වැඩේ කරනවකෝ,1
උඹට අමාරු වෙන්න විදියක් නෑ ඕකිව හොයන්න. අනිත් උන්ට වහල්ලු කිය කිය හෝල් සේල් එකට කඩේ යන එකියක් 🤣 🤣 🤣,1
උපුටා ගැනීම : මහින්ද චින්තනය​ - සුබ අනාගතයක්.,0
මේක මැරයන්ටම ගිය රටනෙ බොල...මහපොලින් යැපෙන ඔය කාලකන්නින්ගෙ ශිෂ්‍ය භාවය සදහටම අහෝසි කිරීම හෝ...කන රත් වෙන්න දෙක තුනක් ගහලා කැම්පස් එකෙන් පන්නලා දැම්මා නම් ප්‍ර‍ශ්නය ගොඩින්ම ඉවරයි. උප කුලපතිට කොන්දක් නැති හැඩයි...,1
චූටි ඉතින් නමට තමා. කොරන වැඩනම් නමට ගැලපෙන්නෙ නෑ,1
ගොසිප්පට බැරිද දන්නේ නෑ සුසාරයා ගහපු බඩු ලැයිස්තුවක් දාන්න. මට හෙන ගැටළුවක් තියනව ශලනි තාරකාටත් වැඩේ දුන්නද නැද්ද කියල. මීගමු කොල්ල දන්නවද දන්නේ නෑ මේ ගැන යමක්. මොකෙක් හරි කමක් නෑ දන්නවනම් දාපන් කමෙන්ට් එකක්.,0
සල්ලි බලෙන් අහිංසකයෙක්ව තලා පෙලා දමන්න කටයුතු කල මරි මෝඩ ගෑණියි...ඒකිගෙ බහට මේ අපරාධය කරපු පොලිසියෙ කාලකන්නි ටිකටයි නීතිය අකුරටම ක්‍රියාත්මක විය යුතුයි. මේවා සහගහන අපරාධ...පව් නේද...තාත්තා කෙනෙක්ට මෙහෙම අපරාධයක් කරන්න...,1
2015 ඉඳන් අද තමා ඒ දවස උදා උනේ 🤣 . සමරන්න ඕන දවසක් 🍻,0
මුන් වගේ කාලකන්නි මූසලයෝ තමයි ලංකාව විනාස කරන්නේ.,1
අන්න එහෙම වුණා නම් මට සන්තෝසයි... මාත් මේපාර යහපාලනේට,0
විමුක්තිකාමී??🤣🤣,0
නැති ප්‍රශ්න ඇති කරන්න යන්නේ. ප්‍රශ්නේ ලොකුවට යන්නේ නැතුව සමතයකට පත් වුනු එකට මූට හෙන දුකයි. එක පැහැදිලියි.,0
ඔහොම කව්රු හරි කිව්වොත් ඔයත් කියන්න මාත් ෆොටෝෂොප් දන්නවා මාත් ඔයාගෙ ෆොටෝ එකක් එඩිට් කරල දානව කියල.,0
🤣🤣🤣 නෑ සිරාවට ඇහුවෙ 😂,0
මූ අර කියපු වෙනම මුස්ලිම් පලාතක් හදන්න තිබ්බ මාර්ගයක් නැති වෙලා සිංහල මුස්ලිම් සමඟින් ඉදී කියල මූට අවුල්.,1
හත්තිලව්වයි මෙහෙමත් කරන්න පුළුවන්ද දෙයියනේ.... කාලකණ්නි පාහරයො,1
ප්‍රතිචාරත් දාල ද? දැක්කෙ නෑ මොකෝ ඕකිගෙ එව්ව බල බල ඉන්න මිනිස්සුන්ට වෙන වැඩ නැතුවටෙයි? 😂,1
රවුෆ් හකීම්,0
වරදට පොළඹවාගැනීම ගැනීම කියන්නෙ මේකට තමයි. 18ට අඩු ගැහැණු ළමයෙක් ආ.. අයියෙ කියල කැමැත්තෙන් දුන්නත් ලංකාවේ නීතිය අනුව වැරදිකාරයෙක් වේ.,0
එකේ සිංහල තේරුම මොකක්ද ?,0
මචන් නරියෝ ඔය කියුවට එක පාරක් හරි වැඩේට සෙට් වෙන්න හිතෙන්වනේ කිරි ටොයියා වගේ එකක් සෙට් උනොත්.,0
ළමයින් වැරදි පාරෙ යනවනම් දෙමව්පියන් ඒකට වගකියන්න ඕනි තමයි.,0
ආ...කස්ටිය ගෑණිව දන්නව නේ? 😂,0
මොනවා උනත් නොයා සිටීම කෙසේ වෙතත්,0
හැබැයි දැන් තියෙන දියුණු තාක්ෂණය ගැන දෙමව්පියන්ට තියෙන අල්ප දැනුම හින්ද දෙමව්පියන්ටම දොස් කියන්න බෑ. හොඳම වැඩේ මේකිට අත පය හතර කැඩෙන්න ගහල කාමරයක තියාගෙන බෙහෙත් කරන එක.,1
පිස්සු හුත්තියෙක්. ලෙඩ්ඩුන්ට බුදු සරණයි. මේකෙ එකාලටත් පොත්ත රතුනම් ඒ ඇති කැහැටු බැල්ලියක් උනත් කරේ තියන් යන්න,1
මූ කවදා හරි මුගේ පණ්ඩිත කමත් එක්ක තියෙන දේවල් සේරම නැති කර ගන්නවා කවුරුහරි ගෑණියෙක් හින්දා,0
නියම වැඩේ,0
දෙවෙනි සාර්ථක දවස උදෙසා යන ගමන් 🌺🙊,0
සිංහල බෞද්ධයා ජාතිවාදීයි.,0
හොඳ වැඩේ කැ... වේ...,1
තැන්ක්ස් බං,0
කෝ එහෙම කියන එවුන් ??? මේ කරපු විනාසෙට නීතියෙන් දඩුවම් ලැබෙනවද? ගොසිප්පා ඒ පිළිබඳව සටහනකුත් දැම්මනම් හොඳයි. පැපිලියානේ සිද්ධියට භික්ෂුන් භාර උනා. එත් මේ ඓතිහාසික විනාසෙට????,0
දැන් 98%කට කරන්ට් තියෙනවා. කරන්ට් එක නැති ඔයා දන්න එක ගමක නමක් කියන්න මට.,0
ඒ සිරාවට 😮🙊 ඒ කියන්නෙ අපේ බබා ඉපදෙන්නෙ නොවැම්බර් 13🙊,0
බෞද්ධයින් තව දුරටත් ඉවසන් හිටියනම් කුරාගල නැවත මෙහෙම ලබාගන්න පුලුවන් වෙයිද ඉස්සරහට ???,0
වතුර ටිකක් ඉහුනොත් තමා වැඩේ..,0
ඇයි ඕයි ඉතින් මේකම නේ හැමතැනම 🤧🤧🤧,0
දකුණු කොරියාව දැනගන්න ඕනේ සර්පයෙම් රෙද්ද අස්සේ දාගන්න හදන්නේ කියල. මොකද ඔය හුරතලේට හිටියට ඕන වෙලාවක ඌ දෂ්ඨ කරන්න පුළුවන් නිසා. මෙතැනදී චීනේ සද්ද නැතුව ඉන්න එක පොඩි ගැටළුවක්. මොකද ඇමරිකාව කොරියාවේ සෙල්ලම් දාන එක චීනෙට හොද නෑ . අනික මුන් දැන් යුද්ධයක් පටන් ගත්තොත් සාමාන්‍ය ජනතාව ගැන කවුරුත් කතා නෑ . යුධ අපරාධ චෝදනා මුකුත් නෑ,0
ගාන අඩු වුණා කියල ඒක හොඳම එක විදිහට ගන්න බෑ. අනික එක එක කම්පැණි වල කොලිටි වෙනස්.,0
ඔව් යකෝ 😂😂 මං හිතන්නේ උඹ කෙනාව අඳුරන් ඉන්නේ,0
උඹල ඔක්කොම ලොකු පුටුවලට වෙලා වැජබියව්.,0
වරදට පොළඹවාගැනීම යටතේ තමයි නඩුව යන්නෙ. ඒතකොට අවු.18ට අඩුනම් කෙල්ල කැමත්තෙන් ගියා කියල කිව්වත් වැඩක් වෙන්නෙ නෑ. කොල්ලට කෙලවෙනවා.,0
කැලයක් කියලා හිතාගෙන ඇඳේ චූ කරලද බලන්න.🤔🙄,0
