ගුරා අාව දවසෙ ඉදන් ලංකාවෙ ක්‍රිකට් වල පල්ලට...ආපු තැනකට ආයෙමත් යන්න ගුරු...,0
ඇයි මෙහෙම වෙන්නේ පාඩුවෙි හිටියනන් ඉවරනි මහත්තයෝ,0
දුකක් නෑ. එපා වෙලා අනේ ඔක්කොම. රෙද්ද.. කිසිම ජොලියක් නෑ.,0
කොහොමත් ලනක්වේ කුණු හොයන්නේ ඇමෙරිකාවේ අයනේ,0
කෝ මේ විමලේ.. විමලේ .....කොහෙද ...මේ...විමලේ .........විමලේ....විමලේ.....,0
දැක්කාම රෙද්ද ඉබේ ගැලවෙනවා😂,0
උඹ කියන චිත්‍ර‍පටිය වගේම ඒ ගුවන් සේවිකාව කරපු උදාර මෙහෙවර ගැනත් මම දන්නවා...ඒවා උනේ ඉන්දියාවෙ බං...ලංකාවෙ ඉන්න ගුවන් සේවිකාවන්ගෙන් බාගයකට වඩා ඉන්නෙ බඩු....,1
....රනිල් අගමැති උනාම එයාර්පෝට් දෙකක් තියනවා .දෙකම වහන්නේ නෑ.අරිනවා.ඒ වුනාට උබට යන්න බෑනේ විමලේ..... උබ හොරාකාපුවා රටට බාරදීලා උබට හිරේ යන්න වෙනව නේ විමලේ....ගෑණිට යන්නත් බෑනේ විමලේ... නම් දෙකකින් ගුවන් ගමන් බලපත්‍ර දෙකක් තිබුනම එයාට යන්න වෙන්නෙත් හිරගෙදර නේද විමලේ...... කැමති එයාර්පෝට් එහෙකින් කැමති තුත්තු කුඩියකට තොලොන්චි වෙලා පලයන් විමලේ උබේ ඔය කුඩු,0
රෙද්ද ගෝල්ෆේස් එකේ පාවෙනවාලු😂,0
පල ඩෝ ලොකු එක නොදී...,1
එයාගේ නතා කරන්න පුලුවන් විදියක් හදලා දෙන්න කරුණාකරලා,0
වැඩම් නෑ බං කියලා.. මේකි මාව නැත්තටම නැති කරනවා.. ආත්ම ගරුත්වෙ කානුවේ.. හර්දසාක්සිය වලපල්ලේ.. රෙද්ද කරේ.. දුක දෝරේ..😔,0
බන්දුලයා කියන්නෙ රෙදි ඉස්කෝලෙට ගිය අම්බරුවෙක්...,1
අනේ සාදු,0
ඌව මකල දාහන් රෙද්ද😂,0
වැඩක් නෑ ඕකා එහෙ ගියාට...අපේ ගෑණි ඌට කියලා උයන්න දර ටිකක් පලාගෙන..රෙදි බේසම් දෙකක් විතර මෙලහකටත් හෝදගෙන ඇති...උපන් ගෙයි ලොල්ලෙක්නෙ...,1
තමන් ගහන කතිරේ අනාගත පරපුර ගැනත් හිතන්න වටිනාකමක් දෙන් නැතිව එක පව්ච්චිකරන්න එපා බුද්දියෙන් තෝරන්න සුදුසු කෙනා . නැතිනම් අම්මල තාත්තලාගේ මොලේ ගැන දරුවෝ කවදාක හරි තේරුම් ගනීවි .,0
ඒ රෙද්ද මොන පාටද බන්😂,0
අහ වල් එක කියන්නෙ තොට නැති දෙයක්...,1
මේ දු දරුවන්ගේ බලාපොරොත්තු ඒ අය හිතන විදිහටම ඉෂ්ට වේවා .,0
රෙද්ද බලපන්කෝ ඉතින්,0
අත් දෙක බදිනවා කකුල් දෙකට...එතකොට මිනිහා වකුටු වෙලා ඉන්නෙ...ඊට පස්සෙ අත් කකුල් මැද්දෙන් පොල්ලක් දාලා උඩ එල්ලනවා...හරියට බඹර චක්කරයක් වගේ පොල්ල වටේට කරකව කවා ගහන්නෙ...,0
මේ සිදුවීම 100% ක් ඇත්ත සිද්ධියක්. 33000 ට මාගේ ප්‍රණාමය හැංගුණු ඇත්තක් එලි කලාට. හමුදාවෙ නියුතු අයගේ ආත්මාභිමානය බිඳලා තියෙන්නේ. අසාධාරණයට එරෙහිව නැගිට්ටොත් හතර වටින්ම ගහනවා නැඟිටින්න බැරි වෙන්න. බුද්ධි අංශ නිළධාරියාටත් සරත් ෆොන්සේකා මහතාටත් වුනේ ඒකයි. එහෙව් එකේ අනෙත් ඈයෝ ඇස් කන් වසා ගෙන වෙන අසාධාරණ කම් ඉවසගෙන තමන්ගේ පවුල ගැන හිතල අසරණ වෙලා ඉන්නවා. ඒ නිසාම කුණු කානු සුද්ධ කරන්න පවා හමුදාවේ අයට සිදු වෙලා. මේකට ප්‍රධාන හේතුව හමුදා වල ඉන්න උසස් නිළධාරින් තමන්ගේ නිළය බලය රැක ගන්න හා වැඩි කරගන්න රාජපක්ෂ පවුලට කඩේ යන එක. උන් කඩේ යන්නේ පොඩි උන් බිල්ලට දීලා . මේකත් එහෙම සිද්ධියක්. මේ අණ දෙන නිළධාරිතුමාත් අසරණයි. ඔහුත් ඉටුකරන්නේ ඔහුට ඉහලින් එන නියෝග,0
අවුරුදු 3කට කලින් පුක වගේම හිට් උන යුරේනිගෙ රතු ජංගිය,0
පල පල ඩෝ...පර්සිගෙ වහලා...,1
නීතිය බල්ලට ගිහින් බල්ලෝ නීතියට ඇවිත්.දැන් ප්‍රද්ශවාසී ජනතාවගේ තීන්දුව දියයුතුයි.නීතියට ඇස් ඇරෙන්න,1
රෙද්ද 😤 අපේ වැඩක් කරගන්න නිවාඩුවක් දැම්මාමත් සයිට් එකේ අරහෙට එන්න මෙහෙට එන්න කියලා කෝල් එනවා එක දිගට 😤😤😡😡,0
අකිලගෙ මල්ලි කිව්වෙ....,0
නඩුකාරයා හැමදාම හොරෙකි,1
රෙද්ද 😤 අපේ වැඩක් කරගන්න නිවාඩුවක් දැම්මාමත් සයිට් එකේ අරහෙට එන්න මෙහෙට එන්න කියලා කෝල් එනවා එක දිගට 😤😤😡😡,0
පල ඩෝ ලොකු එක නොදී......,1
අයිතිකාරයා වගේම වටේම තියෙන ලෑලි ටික් කනවා කියන්නේ අශ්වයාත්. අනේ වාසනාවන් අර ඉස්සරෝම අපේ රටේ පාලකයෙක් අස්සයා පිටින් ගොහින් වැටිලා මළා වගේ දෙයක් වෙනවනම්. මොකද මේ අපේ රටේ අහිංසක ජනතාවගේ සල්ලිනේ.,1
පුක පෙන්නීම...,0
මේක කුලියපිටියෙ හදපු කාර්එ කක්....,0
මචන් මෙහිදී,0
දවල්ටත් රෑටත් වැඩියෙන් ඩේට දෙනවලු. රෙද්ද තමයි යකෝ දෙන එකක් දවල් රෑ නැතුව ඕන වෙලාවක භාවිතා කරන්න දෙන්න බැරුව බොරුවට ඇඩ් දානව.,0
හදවතින් බැදිලා කිව්වෙ බං දෙබිඩි වෙලාද ?,0
මේ කාරණේදී මම හාමුදුරුවොත් එක්ක යම්තාක් දුරකට එකඟයි. කවුරු මොනවා කලත් ආණ්ඩුව කැසිනෝ පනත සම්මත කරගන්නවා. ඒ වත්මන් ආණ්ඩුවේ හැටි. හිතුනොත් කලා ඇයි බලේ තියෙනවනේ. හැබැයි මේ පෝස්ට් එකට ඩිස්ලයික් වැටුනත් මම කියන්නේ කැසිනෝ ලංකාවේ දියුණුවට මඟක් කරගත හැකියි. ඒ අසීමිත බදු සහන දීලවත්,0
අනේ රෙද්ද😂,0
වෙන්නෙ නැත්තෙ තොපි වගේ ගවයො ඉන්ටර්නෙට් යනවා අඩු නිසා...,1
බත් ගොට්ටෝ ටිකක් වෙන්න ඇති ඕකේත් ඉන්නේ. ඉතින් වැඩක් හරියට කොරයි ඈ.........,1
වලට තියනවැ දන්න පුක😂,0
ඉතිං අපිට පාන්ද ? තොපේ පවුලෙ කාටවත් කිසි දෙයක් හරියට බෑ...,0
"ඈ... බන් ගොසිප්පෝ. මේකේ කොමෙන්ට් වල ඉස්සර කුණුහරප විතරනේ කැපුවේ. දැන් එතකොට ""මහින්ද"" කියන එකත් මේ සිංහලේ කුණුහරපයක් බවට පත්වෙලාද​?",0
රෙද්ද එහෙනම් උඹට මීට කලින් මේවගේ ඒව ඇවිත් නෑ😂,0
මානසික අවපීඩන තත්වයක් මේ...විශාදය කියලා කියන්නත් පුලුවන්...,0
පොඩි දෙයක් අපැහැදිලියි. දැන් චීනේ ඔව්වා එවලා තියෙන්නේ රුසියාවේ ඔත්තු බලන්නද​? නැත්නම් රුසියාවට ආපු රාජ්‍ය නායකයන්ගේ තෑගි වලට රිංගලා ඒ අයගේ ඔත්තු බලන්නද​?,0
ලොකු එක නොදී පල ඩෝ...,1
බොදුබල සේනා මෙහෙය වීම කවුරු උනත් මගේ අදහසනම් එය කාලෝචිතයි. නමුත් හැම දේටම මැදිහත් වීම හෝ ඕනාවට වඩා කැපීපෙනෙන්නට යාම අහිතකරයි. ඉන් කරන වැඩ වුනත් අවතක්සේරු වෙන්න පුළුවන්.,0
මළ මිනිය අනිත් මිනිස්සු දැක්කම කොල්ලට ලැජ්ජා ඇති...අනේ මෙහෙමත් මල කෝලං...,0
මගේ අදහස​,0
සිවුරක් දමාගැනීම - දමිත් අසංක පුක පෙන්වීම - පිදුරංගල වීරයෝ සෙට් එකම එකම සෙල් එකට සෙට් උනොත් සිංදු කිය කිය පුක පෙන්නතැකි..,0
පිදුරංගල ගිහිං පුක පෙන්නන්න ඕන ගොනෙකුට පුලුවන්,1
කිරි වෙහෙර ලග පාත ගම්මානයක අහිංසක ගම් වැසියෙකුගෙන් ඇහුවා නම් හොදට කියා දෙයි කිරිවෙහෙරෙ කොබාගෙ විස්තරේ...ගෑණු පෙරේතයෙක් කියලයි අපිට නම් ආරංචි...සිවුරකුත් දාගෙන මේ කරන ජරා වැඩ වලට නිවන නම් පුදුමාකාර දුරයි මුන්දැට...,1
බොදුබල සේනා බෞද්ධ ධර්මය රැකීමට වෙරදරනවානම්,0
උඹලට බෑ අපිට පුක පෙන්නන්න,0
විශේෂයෙන් කියන්ට ඕනි මේ පුක පෙන්නපු ළමයි ඔක්කෝගෙම ගෙවල් වටා ෆ්‍රී වයි ෆයි කලාපයක් ඉදි කරන්න අපි බලාපොරොත්තු වෙනවා ! - රනිල් 😎,0
මෙන්න තවත් තනි ගවයෙක්...,1
රට හැදීමට පෙර සාසනේ ඇති අඩුපාඩු මග හරවා ගත්තේ නැත්නම් විහිළුවක් වෙනවා.,0
පුක පෙන්නල හිරේ යමූ😂😂,0
ඔලුව කැක්කුමයි රෙද්ද.,0
මට පේන්න බැරි එකෙක් ඔය කැලුමා කියන්නෙ...අති පණ්ඩිත...මොන බයිලා ගැහුවත් රටට කිසිම ඵලක් නැති සුද්දියෙක් මූ හදලා තියෙන්නෙ,1
මෙහිදී අන්‍යාගමික සිද්ධස්ථාන ඉදිකිරීමට ඔහේ බලපත්‍ර දෙන​,0
රෙද්ද😒,0
අපි ඉන්නො හුත්තො. ඉක්මනට හොද වෙලා වරෙන්. ආදරෙයි පැලෙන්න ❤️,1
නානසාර රටත් ජාතියක් අගමත් පෙරට දාගෙන ගහපු දේශපාලන ගේමට දැන් ඇපත් නෑ...කොටින්ම මේ චීවරධාරියා දැන් කුණු බක්කියටම වැටිලා ඉවරයි..දැන් ඉතින් සොරි.,0
ගල් කණු බලන්න නෙවෙයි නම් බඩු ගහන්නද​?,1
ගොන්නු රට පාලනය කරාම රටේ ජනතාවත් ඒ ගානට ගන්න යනවා... අධ්‍යාපනයේ විප්ලවීය වෙනස ඉතිං පුක තමා...,1
අම්මපා ඔව් ! රෙද්ද,0
බන්දුවා දර පලලා වතුර ඇදලා ඉවයිද ?,0
එහෙනම් දෙයියනේ කියලා ගල් කණු උඩ බඩුපොට් හදපිය​. නොදකින් මේ වගේ ඇමතිලා. මුන් දන්න ඉතිහාසෙකුත් නෑ. දන්න එකත් නිදන් ට්ක හාරලා ගොඩ කරලා නැති නාස්ති කරන්න හදන්නේ. අර එකෙක් කාලෙකට ඉස්සර කියලා තිබ්බේ ඉතිහාසේ කන්නද කියලා. තුඃ විතරක්. සංචාරකයෝ ගල් කණු බලන්න එන්නේ නැත්නම් සීගිරි,1
අපි හොඳ නෑ අපිට මොකෙක්වත් නෑ ඉන්න උනුත් නෑ හිටියෞනුත් නෑ වෙන වුන් ඕනෙත් නෑ රෙද්ද,0
පුක වෙනුවට පිට පෙන්නපු අපේ එක ! රැල්ලට!!!,0
අල්ලපු ගෙදර ලොල්ලට තියෙන්නෙ බඩු ලාල් ෆෝබියාව..මම යන්නෙ කොහෙද නැට්ට වගේ පස්සෙන් ඇවිත්...යකෝ කී සැරයක් කියන්නද...මම ලොල්ලො පාවිච්චියක් නෑ උඹ වගේ.,1
පොඩි කේස් එකකට තියෙන්නෙ කිසිම මඩ පැල්ලමක්වත් නොගෑවී අතවර කිරීමයි,0
රුපියල පොලිස්පතිගෙන් වැහුවා පොලිස්පති කජ්ජෙන් වැහුවා කජ්ජ පුකෙන් වැහුවා පුක දැන් ජනපති ඝාතනයකින් වහනවා හරිම සන්තෝෂයි,0
නරක වචන කොමෙන්ට් කරන්න එපා හුත්තො 😹😹,1
පුන්නක්කු ඉවර උනා ?,0
මට ඔය වල් බැල්ලි හම'බ උනානමි මමි දන්නවා කරන දේ උබ බෙිරැනා බැල්ලියේ කොල්ලා අහිංසකයෙක් නිසා,1
එකදවසක් ඌ බීලා මට පුක පෙන්නුවා 😁😁😁,0
අරක රිපොට් සීන් එක බොරු හුත්තො උබලා කොමෙන්ට් දාන්වද බලන්න පෙර සූදානමක් මන් කරෙ..කොමෙන්ට් දාල රිච් නග්ගපු ඔක්කොටම ස්…,1
මෙලෝ රහක් නෑ...ගොසිපට අත යටින් සල්ලි දීලා වෙන්න ඕනෙ මේක නිව්ස් එකක් කරගත්තෙ...,0
"ඔබ දෙපලට සියත"" දෙවි දේවතාවන්ගේ ආරක්සාව පිහිට නොවඩුව ලැබෙිවා",0
උඹට මොන පුකේ අමාරුවකටද බං එක එකාගේ පුද්ගලික හිත හදාගැනීම් වලට මාව මෙන්ෂන් කරන්නේ. ඒ මදිවට මගේ පෝස්ට් වලටත්…,1
අපි අත්තනෝමතික ජීවිතයක් ගෙව්වාම ළමයින්ට අහන්න වෙන දේවල්: - උඹලැයි තාත්තා නේ අර පුක පෙන්නලා හිරේ ගියේ? - බොලයි අම්මගෙ වැලක්…,1
මොකුත් කියන්න බෑ....ගවයන්ට රිදෙනවා...මේ දවස් වල පෑවිල්ල සැරකමට මුන්ට බොන්න වතුර මදිද මන්දා...,1
මාතලේ මහ නගර සභා නාගරික මන්ත‍්‍රීවරයෙකු ඇතුළු දිස්ත‍්‍රික්ක කිහිපයක ප‍්‍රාදේශීය සභා එජනිස මන්ත‍්‍රීවරුන් එක්සත් ජාතික පක්ෂයට එක්වීමට තීරණය කර ඇතැයි වාර්තා වෙයි.,0
ඔව් රෙද්ද තමයි,0
කියාගන්න දෙයක් නැති සිරිසේන මහා වැල් බයිලා කියන්න ගිහින් නානවා.. එක අතකින් උන්දැට නාන එක අපි පුක හෝදනවටත් වඩා සිම්පල් දෙයක්…,1
පව් යකෝ..යෝෂිතයා නේවි වැටුපෙන් වෙන්න ඇති මේ බිල්ඩිම හැදුවෙ....කෝ දැන් පර්සිට කඩේ යන ගවයො රැල ?,1
අදහන්න ඔින කෙල්ලෙක් සුභ අනාගතයක්,0
ඒක තමයි. ඒ මනුස්සයගෙ මාකටින් හරි මොන රෙද්ද හරි ඉතින් පාරෙ ඉන්න සතෙක්ට හරි හොඳක් වෙනවනෙ. උන්ට කැලේ ඉන්න වල් ඌරො…,0
ගමේ කොල්ලො කරොත් පුක පෙන්නනව.......සුද්දො කරහම,0
පව් යකෝ පර්සි...බන්දුලයට කලක් යයිද ඉතින්...,0
මු වගේ බුරැවෙක් උබෙි ඔක පණනැති වුනාම ගෑනි වෙන එකෙක් එක්ක යනවා යකෝ,1
හුත්ත වල හැමදාම යන එවුන් හිතන් ඉන්නේ එක උන්ගේ අප්පගේ කියලා. අනික් එවුන් උන්ට යටත් වෙලා යන්න ඕනේ. වරෙං…,1
හැපි බර්ත්ඩේ පක යා,1
අනේ පල ගවයො...හේන පැත්තෙ ආවොත්..සත්තයි මැහුම් දාන්න වැඩේ කරලා යවන්නෙ...,1
අපිට තොගේ හලාල් ‍මොක=ත්ම ඉපා ජාති ජන්මයක් නැති උ!රෝ තොගේ සුන්නත් කරලාද අහවල් එක,1
දැන් නම් අරුන් සෙට් එක රෙන්නවත් පුක එලියට ගන්න එකක් නෑ,1
අපි අත්තනෝමතික ජීවිතයක් ගෙව්වාම ළමයින්ට අහන්න වෙන දේවල්: - උඹලැයි තාත්තා නේ අර පුක පෙන්නලා හිරේ ගියේ? - බොලයි අම්මගෙ වැලක්…,1
කටවල් දෙක තුනක් නෑ බොල. මම විශ්වාස කරන සත්‍ය වෙනුවෙන් මම ඕනෙම වෙලාවක පෙනී සිටිනව...ලයික්ද ඩිස්ලයික්ද වැටෙන්නෙ...ඒක මට අදාළ නෑ.,0
මූණ කචල් පුක සුරතල් උන් තමයි ඔය පුකේ දාන්නෙ😂😂 දැං ඩිංග බැරිවෙන්න බෑ පුක පෙන්නල දුවන්නෙ😂😂 #පුකපෙන්නීම,1
වඩා දරුණු පුක පෙන්වීමද? මහජන මුදල් කොල්ල කෑමද?,0
මේවා මේ කීයක් හරි ගරාගන්න කරන අනවශ්‍ය වැඩ...ත්‍රී වීල් එකට අත තියන්න කලින් බොල සයිටම් එකේ ගැටලුව විසදලා තාජුඩීන් ගෙ මිනීමරුවව අල්ලලා හිටපියව්කො.,0
1. වැටේ වරදට වඟ නොකියන බව පෙර ලිපියක සඳහන් වුන බව මතකයි.,0
පිදුරංගල ගිහිං මුලින්ම පුක පෙන්නපු පුද්ගලයාගෙ නම්බර් එක මං ගාව තියෙනවා. මම දැන් කෝල් එකක් අරං පෙන්නන්නම්.,0
දැන් මේකනේ..බ බ බ.. ඔතන ඇත්තටම මුලින්ම පුක පෙන්නුවෙ මමයි. බ බ බ... ඒ පිලිබඳ සාක්ෂි ඔක්කෝම දැං මං ළඟ තියෙනවා. ඒත් මම පුක පෙන්නපු කාලේ පේස්බුක් තිබුන්නෑ බ බ බ.. - චතුර 😎,0
පිස්සු යකෙක්.,1
2. දැන් කකුල අහිමි මන්ත්‍රී වැටට ගෙවිය යුතුද​? ගෙවනවාද​? ගෙවනවානම් පුද්ගලික මුදලින්ද​?,0
මේ පුක පෙන්නපු ළමයි ඔක්කෝම හඟුරන්කෙතට ගෙන්නලා උන්ගෙ කලිසං ගලවලා පිස්සො වගෙ පිස්සො වගෙ පාර දිගට ගාල් කරන්න කියලා මම ජනාධිපති තුමාගෙන් ඉල්ලා සිටිනවා ! - ඇස් බී 😎,1
දැං බලන්න අපේ හාන්දුරුවලේ.. පිදුරංගල ගිහිල්ලා හැමෝටම පුක පෙන්නනවා. අපේ කාලෙ ඔහොම පුක පෙන්නන්න දුන්නෙ නෑඈඈ... දැං පුක පෙන්නුවම සැපද.... - මහින්ද 😎,0
උබේ ගැනී ඒ පැත්තට යනවා මම දැක්කා,0
3. ගම් පහ මන්ත්‍රීලා අධිවේගේ අධිවේගෙන් මොණරාගල යනවාද​? (නියමිත වේගයට වැඩිනම් මන්ත්‍රී රියදුරු වගකිවයුතුයි නේද​),0
පහුගිය දවසක මේ පුක පෙන්නපු අය ගැන සොයා බලන්න මම ගියා පිදුරංගල. කන්ද නගින පාරෙ තිබ්බ කඩේකින් මම කෑවා කජු ටිකක්. බල්ලෙකුටවක් කන්න බෑ ඒ කජු ! - සිරී 😎,0
