1. මහින් ද මහත්තයා එයාටම කියලා අධි සුඛෝපභෝගී ගුවන් යානයක් ඇනවුම් කරලා කියලා ආරංචියි. ඇත්ත නැත්ත දැනගන්න ඕනේ.,0
මොන ප්‍ර‍ශ්නයක් උනත් චීත්තයක් එතන ඇති අනිවා...,0
දන්නව මචං. කියල වැඩක් නැතිනිසා කටවහන් ඉන්න ව ඉතින්...,0
"2. ""වොල්ගා කල්පනී"" ගේ ඡායාරූප සහ ගොසිප් ටිකක් අවශ්‍යයි.",0
උගෙ සින්දු උඹ දන්නෙ නෑ කිව්වම උඹ හරි පොෂ් ද බං...පව් යකෝ උඹ...,0
හම්මො.. 😂😂😂😂😂 ඒකත් කමක් නෑ කියමු. කාසි වෙනුවට පැපීව උඩ දාන්න ඔට්ටු නෑ.. 🤭,0
3. කැළණි පාලම සිට පටන් ගනා අහිවේගයේ පාළම,0
උඹේ පොට කැපුවා කියලා අනිත් මිනිස්සු මක් කරන්නද බං...කන්න නැත්තං කුණු බක්කියකින් හරි අහුලගෙන කාහං...ජාතකයක් නැති කාලකන්නි.,1
හුම්ම්ම් උං උඩයන්න උඩ යන්න අපිටයි අමාරු.,0
කවුද බන් මුන්ට නඩු කියලා හිරේ යවන්න ලංකාවේ ඉන්නේ?,0
සිරාවට මගේ ලැපක් හොරකම් කළා ගිය අවුරුද්දෙ කැළණියෙදී. මාස 7කට විතර පස්සෙ හොරා අහුවුණා ත්‍රිකුණාමලේදී. දැන් නඩුව යනවා කිරිබත්ගොඩ උසාවියේදී. නඩු භාණ්ඩයක් විදිහට මගෙ ලැපත් දාල තියෙන හින්ද මමත් ඔක්කොම වැඩ පැත්තක දාල යන්න ඕනි නඩු තියෙන දවසට. හැමදාම නඩුව කල් යනවා ඇයි ඉතින් හොරා ඇප පිට නිදහස් ඌ කවදාවත් නඩුවට එන්නෙ නෑනෙ. ඌ දැන් ආයෙ කොහේ හරි හොරකමේ යනව ඇති ඌට පිස්සුවක් ඇතෑ නඩු වලට එන්න. හොරා ඇප හම්බ වෙලා ආතල් එකේ ඉන්නවා. නඩුව කල් යන සැරේකට අපේ වැඩ පාඩු කරගෙන පලයන්කො උසාචි. මොහෙමත් ලෝකයක් සිරාවටම,0
ඔහොම තමයි උඩ තට්ටුව කුලියට දුන්නම,0
දෙපැත්තම එකයි. මෙහෙන් දැම්මොත් ගෝණි පිටින් හිරේ.,0
ප්‍රසිද්ධ පුද්ගලයොත් එක්ක සෙට් වෙන ගෑනු සෙට් වෙන්නෙ සල්ලි වලට. සනත් කීදෙනෙක් බැන්දද. ඔය හැමෝටම ඕනි සල්ලි විතරයි... අනේ පව් අසරණ ගෑනියි ලමයි ටිකයි කියල අපි කිව්වට...,0
පැපී දැන් #මාතර_අහස_උඩ,0
එහෙන් දැම්මත් එහෙම්ම තමයි. එකම දේ යූ එන් පී රනිල් ළඟ හොරකම නෑලු (මමනම් දන්නේ නෑ ඉතින්) හැබැයි ඒකටත් එක්ක අනෙක් උන් දෙනවා ඇට්ටි හැලෙන්න​. ඇමති සභාපතිලා ගැන කියන්න දෙයක් නෑනේ අමුතුවෙන්.,0
ඔබ දෙපලට හදවතින්ම ආසිරි පතනවා....!,0
රිදිච්ච උන් ටීම් එකේ නම නැතුවම උඩ පනිනවා බං. බලපං. 🙊🙊🙊,0
බට්ටිගේ බිස්නස් එක සරු වෙනවා ඒකෙන් මේකෙන් ෂුවර්.,0
නෑ මචන් එයාල තමන්ගෙ ආත්ම ගරුත්වය ගැන තමයි වැඩිපුර වද වෙන්නෙ...,0
මොකක් ගැනද බං කියවන්නේ??,0
මචෝ මහින් දටවත්,0
අපෝයි ඔව් මහලොකු දේශප්‍රේමියො ටික. නිකන් කඩේ යන්නෙ නැතුව හිටපල්ලා එක එක කාලකණ්නින්ට. ඔය කොයි එකත් දේශපාලනේට ඇවිල්ල තියෙන්නෙ වවාගෙන කන්න...,1
මොකක්?,0
එහෙත් යුද්ධයක් මෙහෙයවීමට දක්‍ෂය​. චන් ද්‍රිකා මැතිනිය ෆොන්සේකාව උසස්වීමක් නොදී තබාගත් අතර​,0
ගොනෝ... වැරදි කාරය ළමය නෙවෙයි. උගෙ අයියා. මේක හොරකමකුත් නෙමෙයි වලියක්. හරියට කියවල ඉඳහන් ඉස්සෙල්ලා.,1
උඩ පොඩි සිපයියෙක් පෝම් වෙලා ගනන් ගන්න එපා,1
අද උදේ ප්‍රවෘත්තිවලට කියුවේ නම්,0
අපි හැමෝම ටියුෂන් පන්ති ගිහින් තියෙනවනෙ. පොඩ්ඩක් හිතල බලන්න ඔයාල පන්ති ගිය එක සර් කෙනෙක් හරි ටියුෂන් ෆීස් දුන්නෙ නෑ කියල අතින් පයින් ගහනවද කියල.,0
දඹුල්ලෙන් උඩ ගිය වායු බැලුනයක්,0
ගොසිපත් හොයාගන්න දේවල්. කවුද බන් ලිපියක් කියවද්දි වචන අනෙක් පැත්තට කියව කියව බලන්නේ. ඈ බන් ගොසිපෝ උඹට වැඩ නැද්ද​?,0
කොයි ආණ්ඩුවත් එකයි අනවශ්‍ය බලයක් අතට දුන්නහම වෙන්නෙ ඕක තමයි. ශක්තිමත් විපක්ෂයක් ඉන්න ඕනි. අවශ්‍යෙද්ට සහයෝගය දෙන්න ඕනි වැරදි දේ නවත්තන්නත් ඕනි. ඒ උනාට මේ විපක්ෂෙ කරන්නෙ ආණ්ඩුව කරන හැමදේටම වැරදියි කියන එක. ආණ්ඩුව කොච්චර නරක දෙයක් කළත් ඊට විරුද්ධව හරිහමන් උද්ඝෝෂණයක් සංවිධානය කරගන්නවත් මුන්ට බෑ. මේ හැම දේකින්ම කෙලවෙන්නෙ අපිට විතරයි. ආණ්ඩුව කෙල්ලො කොල්ලො මර මර,0
එකේ උඩ පහල යද්දි බුටක් කාපු කෙල්ලක් ගේ අදෝනාවක් වරදින්නේ නැ 😃,0
දැන්නම් එහෙම මුකුත් අනවශ්‍ය ඒවා වෙබ් ලිපිවල අකිනට නොමැත​. ගොසිපාගේ වැඩෙ අහුවෙලාද දන්නේ නෑ,0
අද කොළඹ ජීවත් වෙනව කියන්නෙ කොච්චර අමාරුද. රුපියල් දාහක් නැතුව පාරට බහින්නත් බෑ.,0
මොකක් කිව්වා 😠😠 ඩැෆ්නිට පස්සෙ මගෙ එක මෙයා 😂,0
හරි ආදායම පැත්තකින් තියමුකෝ.,0
හැබැයි ඡන්දෙ ළං උනාම බලන්න ඕනි කියන කථා. ආණ්ඩුව මෙහෙමයි අරෙහෙම කළා මේක වැරදියි අරක වැරදියි මේක දූෂිතයි නීතියක් නෑ....... අප්පේ කියන කථා.,0
උඩ එකාද,0
එතකොට මම ඉදිරිපත් කරපු අනෙක් කාරණාවලට සම්බන්ධව බැලුවාම මොකද හිතෙන්නේ? අපි දැනට 9 වැනි තැන ඉන්නවා. හැබැයි මෙය මීට වැඩිවිය යුතුයි. මොකද බාල වයස්කාර දැරියක් දූෂණය උනාම පොලිසියට ගියොත් විතරයි ඒක වාර්තාවෙන්නේ. කොයිතරම් දරුවන් ඉන්නවද ලංකාවේ ඕක රහසක් විදිහට තියාගෙන​? අනෙක් අතට කැමැත්තෙන් උනත් ලිංගිකව හැසුරුණු වයස 18 ට අඩු ගැහැණු ළමයෙක් ගැන දෙමව්පියන් හෝ නිලධාරීන් දූෂණයට ලක්වුනා කියලා වාර්තාකරනවා. සමීක්‍ෂණ වාර්තා පැත්තක තියමු.,0
මම අහන්නෙ ආණ්ඩුවේ වැරදි කියන එක විපක්ෂෙට ඡන්දෙ දෙන්න හේතුවක්ද?,0
හ්ම්ම් අන්න එයා ගං වතුර වෙලාවේ උඩ තට්ට්ටුවේ ඉන්නේ නැතුව ඔයාලාගේ ආපු කෙනා 🤣🤣🤣,0
දියුණු රටවල දූෂණය වෙනවා තමයි. හැබැයි බලන්න ඒ දූෂකයින් බොහෝමයක්,0
නෑ.... තොපි එහෙම නෑ කියල හරිහමන් වැඩපිළිවෙලක් පෙන්නපල්ලා. මම දෙනව ඡන්දෙ,0
මොකක්,0
මචෝ... ඒ උනාට ලෝක සමීක්‍ෂණ වාර්ථා ගත්තාම අපේ රටේ ස්ත්‍රී දූෂණ වැඩියි. අපරාද වැඩියි. ළඟදීත් සිල්මාතාවක් පවා දූෂණය කාලා තිබ්බා. පාරේ කෙල්ලෙක් යද්දි නොමනා විහිළුකරනවා විදේශිකයන්ට පවා. එතකොට කාටද ඔය සංස්කෘතිය සභ්‍යත්වය තියෙන්නේ? කාටද ඕක පේන්නේ? නමට සභ්‍යත්වයක් තිබිලා වැඩක් තියෙනවද​? එදා ඉඳන්ම අද වෙනකම් ලංකාවේ ගණිකා වෘත්තිය තියෙනවා. විදේශිකයන්ට සමලිංගික සහ ගැහැණු පිරිමි දෙපාර්ශවයෙන්ම ගණිකාවෝ සැපයුම තියෙනවා. ඔවුන් දවස් ගණන් පෙම්වතිය සේ සේවවන් සපයා ගන්නවා. ලංකාවට ආපු එක සුද්දෙක් මාත් එක්ක කියුවා දවසක් මාලදිවයිනට(දවසක් ඉන්න) යනවට වඩා ලංකාවට ඇවිත් සතියක් කෙල්ලෙක් අරගෙන​,0
වේරහැර ලටෙක් එක නවත්තල දැම්ම. සේවකයන්ගෙ ඊපීඑෆ් එක වත් නෑ. තාම නඩු. දැන් ඉතින් පුක උඩ දාගෙන ගෙනපල්ලා ඉන්දියන් බස්.,0
මං උඩ😂😂🔫,0
1. වෙබ් සයිට් නිසා හොඳට තියෙන පව්ලුත් කඩාකප්පල් වෙනවා.,0
ආණ්ඩුවේ තව කොච්චර ආයතන මුන් විකුණල දැම්මද.... තොපිට මුකුත් මතක නෑ........,0
උබේ මොකක් දිගේ😂,0
2. මෙයාට කියලද දන්නේ නෑ හරීන් හැම වෙඩේම කරන්නේ. එතකොට හිරුණිකා??? ඉතින් නදීෂා එක්ක හිටියත් වයිෆ්ට කියන්නේ මොන මිනිහද?,0
ඒ මොනදේ උණත් කමක් නෑ. අඩුම තරමේ මහින්දයගේ ජරා පාලයන නවත්තන්නවත් මුන්ට කිසිම උවමනාවක් නෑ... කාලකන්නි හැත්ත. මහින්දයා පිනුම් ගහනවා උඹල බලන් හිටපල්ලා...,1
මොකක් ද මොකක් ද අැත්තට හෙට😁😁😁,0
නුඹ නාඩන් අපිට පිස්සු,0
අනේ චෝයි බබා... මචන් කිසිම දවසක සට්‍රයික් නොකරපු / නැච් ගේන්න තරම් සල්ලි තිබ්ච්ච සමූපකාර තොග වෙළඳ සංස්ථාව පාඩුයි කියල මුන් විකුණුවා.ඒකෙ සල්ලි වලට වෙච්ච දෙයක් නෑ. දැන් වෙලා තියෙන බඩු මිල වැඩි වීමට සම්පූර්ණයෙන් වග කියන්න ඕනි යූන්පී ආණ්ඩුව. ආහාර ආනයනය සම්පූර්ණයෙන් කළේ සතොසෙන්. පුද්ගලික ආයතන සියළුම බඩු ගන්න ඕනි සතොස හරහා ඒ කාලෙ බඩු මිල පාලනය කළේ එහෙමයි. දැන් ඉතින් පුක උඩ දාගෙන පලයල්ලා ෆුඩ්සිටි. දැන් සතොසට බඩු ගන්නෙ පෞද්ගලික අංශෙන්.. අයියෝ සල්ලි....,0
මොකක් කියලද කිව්වෙ 😂,0
මොනවා උනත් මාරු ගල් දෙක. කිරිපාටට දිලිසෙන හැටි දැක්කම බදින්න හිතෙන්නේ නම් නෑ ගහන්න හිතෙන්නේ. ඒ අස්සේ අර බත්කන එක මතක් වෙනකොට තවත් ඉන්න බෑ. එත් ඒ කාලේ මෙච්චර හොද කකුල් දෙකක් තිබ්බේ නෑනේ....,1
අනේ බොල ගවයො...උල්කාපාත වැටෙන වෙලාව කලින් කියන්න ඇමරිකාවටත් බෑ...උඹ නම් රෙදි ඉස්කෝලෙටවත් ගිය එකෙක් නෙමෙයි.,1
අපි ඒමයි මල්ලි. යවනකොට යවනවා හොයාගන්න බැරි වෙන්ඩම උඩ.,0
අද හම්බෙලා හෙට බඳින එක කෝකටත් හොදයි. නැත්තනම් කොල්ලට එපා වෙයි කැරැට්ටුව දැනගත්තම. අනංමනං වැඩිය හිතන්නේ නැති එකෙක් හම්බුනොත් හොදයි. කෙල්ලට දැන් සැප දෙන එවුන් අඩු වෙන නිසාද දන්නේ නෑ බදින්න හිතුවේ...,0
කොල්ලා ලොකු එක දෙන්න ගිහින්...ඇදගෙනම නාලා...,1
#ආතල්මල්ලි මොකක් පදනම් කරගෙනද මෙ🤔,0
හොඳ වැඩේ. අන්තිමේදී අහුවුනා පරයව. එත් ගොසිප්පෝ සිවුරු ඇරපු පාපතරයෙක් ගැන ඇයි සිවුරු දාපු ෆොටෝ එකක් එක්ක දාලා??,1
අපි බදිමු ශලනි....මම ඔයාව මලක් වගේ බලාගන්නම්,0
හම්සයි ඔයයි තමා උඩ යැව්වෙ,0
මෝඩ යක්කු... මුන් මේක කරන්නේ බුදුදහම එලවන්න හිතාගෙන මිසක් ෆේස්බුක් ටැග එකකට නෙවෙයි. මොකක් හරි කොනක් අල්ල ගන්න හදන්නේ. මොන වුනත් මුන්ට මේවා පලිසන් දෙනවා. අපරාදේ ඉපැරණි දේ ගැන අගයක් දන්නේ නැති මූසල හැත්ත. බුදුදහම නැති කරන්න නම් අමාරු වෙයි ගොය්යෝ,1
තූ නෙදකින්...,1
මිදි තිත්ත උඩ පැනල ඉවර උනාමනෙ,0
යකෝ මෙච්චරකල් මම අහල තිබ්බේ සතුටින් පවුල් ජීවිතයක් ගතකරන්න ජපන් ගෑණියෙක් බඳින්න කියලනේ.... දැන් බලන් ගිහාම අපේ උන් හොදයිනේ.....,0
මහත්තයා...මූ වගේ පරයෙක්ට ?,1
මෙතන මොකක් නමුත් ලොකු දෙයක් සිද්ධ වෙලා තියෙනෝ,0
අම්මව රවට්ටලා වෙන්නත් පුළුවන්. එත් දැන් කාලේ අම්මල කරන දේවල් විශ්වාස කරන්නත් බෑ. මොනවුනත් ගෑණි දීල තියෙනවා සුපිරි ගේමක්. පව් අසරණයා. හැබැයි කවදාහරි මරණෙන් ගොඩ ආපු මේ මනුස්සයට සාධාරණයක් ඉෂ්ඨවේවි.....,0
මොනවා පරීක්ෂණ කරන්නද...වීඩියෝ එකේ පැහැදිලිව පේනවා නිළ ඇදුමෙ උෂ්ණය ඇගට ගහලා මේ කාලකන්නියා අර කොල්ලගෙ කනට ගහන හැටි...නීතිය උපරිම තදින් ක්‍රියාත්මක කරලා මේ අදමයගෙ නිළ ඇදුම ගැලවිය යුතුමයි.,1
නෑ නෑ මම බෝනික්කියෙක් නෙවෙයි🙊🙊😂 - උඩ යැවීමට ලක් වූ පසු ට්වීට් කරන ලද්දකි-😂😂😂,0
මට හිතාගන්න බෑ මූට ජනප්‍රිය නළුවා වෙන්න කවුද කැමති කියලා. පුදුම පන්දිතකමක් මූට තියෙන්නේ. ඌ හිතන් ඉන්නේ ඌ තමයි පොර කියල. මට තාම මතකයි මූ ඇඟ පුම්බා ගන්න ඉස්සර හිටපු හැටි විජය කුමාරතුංග නෑයෝ කියකිය ඒ වගේ කොන්දේ හදාගෙන.,1
උඹ පාර්ලිමේන්තු මන්තිරියෙක් නේද....උඹ දැන් කියන්නෙ අපිට ඇවිල්ලා ඕක නවත්තන්න කියලද...නායකයා කියන එකා පාරෙ යන වෙලාවක් බලලා ගහපියකො උගෙ කන කුඩු වෙන්න...ඌට දෙක වදිනකොට ගෝලයන්ට දුවන්න පාරවල් මදි වෙයි.,1
මොකක්,0
මුගේ තාත්තා ආචාර්ය වුනා වගේ හිතන් ඇති අධ්‍යාපන ඇමති වෙන්න. මොනවද දන්නේ නැ ඉගෙන ගන්න යන්නේ. මොනවුනත් හමුදාවෙන් මැරුම් නොකා අපේ සල්ලි වලින්ම රට පනින එක හොඳයි.,0
මු වගේ ගවයෙක්ට සර් කියන්නේ තොගේ මුල් ළමා විය සංවර්ධනය වෙලා නැද්ද ?,1
එතකොට සුකියා ඇවිත් ආයෙ උඩ යවනවනෙ,0
මොනවා උනත්,0
උබත් මැරියන්කෝ...,1
ඒ උනාට අන්න කෙල්ලොන්ට බනිනව කොල්ලො පස්සෙන් ආවට උඩ යන්න එපාලු ඉල්ලුම වැඩි බාල බඩු වලටලු🤦🏼‍♀️🤦🏼‍♀️😂,0
1. ඒකට කියන්නේ ෆර්දාව නෙවෙයි,0
ඔච්චර නැගිටලා අත්පුඩි ගහන්න තරම් සුපිරියක් නෑ....උන්ට ඕනෙ මේ කොල්ලා දිනයි කියලා පොඩි ට්‍රෙන්ඩ් එකක් හදලා ෆයිනල් එකේදි වෙන එකෙක්ට දිනුම දීලා ප්‍රේක්ෂකයා පුදුම කරන්න. මේ වගේ කුජීත මාකටින් දෙරණට තියෙන්නෙ....සමිතා..තොත්ත බබා අඩන්නමයි බලාන ඉන්නෙ...පව් කියලත් හිතෙනවා බං රුපියල් ශත නිසානෙ මේ දුක...,0
හ්ම්ම්ම් දැක්කා එක දැන් ඩිලිට් නේ.. අඩේ ඔකා එක්ක හුරතල් වෙන්න තරම් මට මොකක් හරි මානසික අවුලක් තියෙනවා වගේ පේනවා ද🤔🤔,0
2. ෆුල්ෆේස් තහනම් කරලා තියෙන්නේ මෝටර් සයිකලේ පදින කෙනාට​. මම අද දැක්කා පිටිපස්සේ කෙනා ෆුල් ෆේස් දාලා. දැන් මංකොල්ල කන්නේ ඉස්සරහා එකා විතරමද​?,0
ඈ දැන් ගූගල් එකට ඕනි විදිහටද ප්‍රශ්නපත්‍ර උත්තර බලන්නෙ ඈ....,0
මොකක් 😂,0
3. ඉස්සරහට කියයිද දන්නේ නැහැ ඔක්සිෆියුරා,0
කෝ මේ මහලොකු ගූගල් මැප් මේකර්ලා....,0
මං දන්නව මමත් එක්කෙනෙක් කියල අක්කෙ🤗,0
මෝඩ ජෝක්ස්. මාමස්මි කියන අපරාධකාරය හැඟිලා හිටියෙ අන්තිම වතාවට අල්ලද්දිත් බුර්කාවක් ඇතුලේ. එතකොට මෙලෝ තේරුමක් නැති බුර්කාව හොඳයි,0
ඈ දැන් ගූගල් එකට ඕනි විදිහටද ප්‍රශ්නපත්‍ර උත්තර බලන්නෙ ඈ....,0
ලබ්බට කෝටු ගහපු පඩරැලක් හරි ලස්සනට පේන ගොං හුත්තලා ඉන්නකන් ලංකාවෙ ඉන්න ඕන ගොං බඩුවක් මේකප් ටිකක් උලාගෙන උඩ යයි...🤢 #නොදකිං #ආතල්මල්ලි,1
මුන්ට ඉතිහාසෙ වැඩකුත් නැහැ. අනාගතේ එකෙක්ට වැඩක් ගන්න දෙන්නෙත් නැති වෙයි වගේ. බලේ තිබ්බට මොලේ නැති උනාම මේ වගේ අදහස් එනවා. පිස්සු නටන්නේ නැතුව හිටියොත් හොඳා මමනම් කියන්නේ.,0
ශ්‍රී පාදය තියෙන්නෙ සබරගමු කඳු වැටියෙ. සබරගමු කඳුවැටිය තියෙන්නෙ මධ්‍යම පළාතෙ කියල කව්ද බොල සිතියමේ ලකුණු කලේ.,0
ඊයේ මේ පැත්තට එන්න බැරි වුනා. මොකක් හරි ක්‍රිකට් සීන් එකක් වුනාද ? අපේ එවුන් ටුවර් එකක් වත් දිනලද ? මොකක්ද අර ඉමේජ් සීන් එක ? 🤔,0
ඔෆීෂියල් පේජ් එක උනාට සහතික (ස(ර්)ටිෆයි) කරල නැහැනේ බුකියේ?,0
බස් එක වැරදී නෑ. ඩිපෙන්ඩර් කාරයම තමයි ඉරි කපා ගෙන ගිහින් වංගුවේ ඇණගන්නෙ.,0
මොකක් 😭 නෑ අරක හොඳයි 😏,0
