මේ වේසිට නීතිය ක්‍රියාත්මක වෙන්නෙ කවදාද ?,1
තූ ෙනදකින්,1
අම්මා ලුසීඩා කියුවම මට හිතෙන්නම ෆලූඩා කියලා. හිකිස්. ඔව් ඔව් තරුණ වයසේ ගෑණු ළමයි විවිඪ රට වලින් ආශ්‍රය කලාට කමක් නෑ. ලෙඩක් කාරියේ හදා ගත්තම තේරෙයි අප්පගේ ආදර බර පුතාට​.,0
දින ඒකාබද්ධ විපක්ෂයේ මාධ්‍ය ලේකම් රේණුක පෙරේරා මහතාගේ නිවේදනයට අදාාලව අමිත් වීරසිංහ කල මාධ්‍ය සාකච්ඡාව..…,0
පූදින්ෙන නැතුව ඉදිං,1
ඇමති පඩිය ඇතිද කියල අහුවම මේකි කියන්නේ වාහන් දෙකයි එයාට තියෙන්නේ කියලා. එතකොට අප්පටයි,1
මා හෝ ඒකාබද්ධ විපක්ෂය මගින් හෝ දැනට පවතින කිසිම පක්ෂයකින් ඡන්දයකට ඉදිරිපත් වෙනවා කියා නැ.. ඒකාබද්ධ විපක්ෂය වැනි වි…,0
උඹ එක්ක එකඟවෙන්න පුලුවන් කථාවක් තමයි අද බොලා කියලා තියෙන්නෙ...මුන්ගෙ සනුහරේම උපන් ගෙයි මරිමෝඩ හැත්තක්...මූ නීති විභාගයෙන් ලංකාවෙන්ම වැඩිම ලකුණු අරගෙන වාර්තා පිහිටුවාලු සමත් උනේ ඒත් උන්ගෙ හිතවතුන්ගෙ සියලුම නඩු වලට නීතිඥයො හොයාගෙන එන්නෙ පිටින්. ලොකු උන් වගේම පොඩි උනුත් කම්බා හොරු...මේ වසල පවුලේ සුබ සිද්දියට කාබාසිනියා කරපු මුදල් ලංකාවෙ සාවර්ධනයට යොදාගත්තා නම් ලංකාව මීට වඩා ගොඩාක් වෙනස් තැනක අද තියෙන්නෙ..තූ නෙදකින්,1
කොළඹ යුගයේදී කියලා වෙන්න ඇති මගේ හිතේ කියන්න ඇත්තේ.... හිකිස්... ඒ පවුල හරි දැන උගත් පවුලක්නේ මචෝ,0
කිමද මේ තරම් කොහේදෝ ඇති විදපු ගලක් හා උරන මා මිතුරු පරය?,0
අපි බෞද්ධයෝ විදිහට ස්භාව දහමටත් මනුෂ්‍යත්වයටත් ආදරේ නිසා,0
එකට බුදියගෙන ළමයි හැදුවට පස්සෙ මොන මගුලද බං..මූට ගිහින් තියෙන්නෙ රෙජිස්ටර් කරන වියදම විතරයි,0
ගොසිප්පෝ මේවගේ අවයව වෙන්වීමකදී ගතයුතු ක්‍රියාමාර්ග හරියට දැම්මනම් මේකත් එක්ක වටිනවා නේද​? අයිස්වල දාගෙන එන්න කියුවට,0
එහෙම කොහොමද උනේ 😂😂 පරය අපිව අයින් කරල නේ 😂,0
ඉතිං අපිට අඩන්නද බොල කියන්නෙ...මූ හෙන මෝඩ චූන් එකක්..,0
මේක පාවිච්චි කරපන් නැත්නම්,0
විමලයා ගොනෙක් වගෙ එකෙ මෑරෙන්න හදනවා.... පරය. රටට වෑඩක් කරපන් යකො. හොරා....,1
හතුරා එක්ක බුදියගෙන වගේ දැන් දැන් මෙන්ඩිස් ක්‍රිකට් ගහන්නෙ...පිට්ටනිය මැද්දට ගියාම හතුරගෙන් වෙන් වෙලා කියලා කොල්ලට හිතෙන හින්දම ඉක්මනට අවුට් වෙලා ආයෙමත් හතුරට ලං වෙනවා...සරලයි...,0
මේකත් හොඳා,0
ලැජ්ජයි ස⁣හෝදරයා මේ යන විදිහ දැක්කාම. ඔබලාගේ මේ කුලල්කෑම නිසා වාසි ගන්නේ තම්බි වහබ්වාදීන් සහ දෙමළ බෙදුම්වාදීන්,1
කොහෙද බං මේකෙ අඩෝ කියලා කෑල්ලක් තියෙන්නෙ...,0
ඩිලා එක පාරක් බුදුදහම ගැන කියලා තිබ්බා. ඌ බුදුදහම ගැන පැහැදිලා ඉන්නේ. ආයෙත් පල්ලි බදා ගන්න එකක් නෑ. හැබැයි කියන විදිහට දේශපාලනයටනම් එයි වගේ. එහෙම වුනොත් නම් ඩිලා අතීතයේ කල හොඳ වනසා ගැනීමක් වෙයි.,0
ලැජ්ජයි ස⁣හෝදරයා මේ යන විදිහ දැක්කාම. ඔබලාගේ මේ කුලල්කෑම නිසා වාසි ගන්නේ තම්බි වහබ්වාදීන් සහ දෙමළ බෙදුම්වාදීන්,0
මුගෙන්ම ඉල්ලගත්ත චීන කටුවක්...මුගෙ අහවල් එකට ගැහුවා නම් ඔය අසනීපෙ නිට්ටාවට සුව වෙයි...,1
තමන්ගේ නම්බුව රැකගෙන නවකයන්ට තැන දෙන එක ගැන සතුටුයි. අනික් කාරණය ටෙස්ට් තරඟවලට ඩිල්ශාන්ගේ පිතිකරන විලාසය ගැලපෙනවාද සහ ඔහු ඉවත්වීම තුලින් කණ්ඩායමට විශාල බලපෑමක් සිදුවෙනවාද යන්න​. කෙසේ වෙතත් ඩිල්ශාන් වැනි ක්‍රීඩකයෙක් නොමැතිනම් ශ්‍රී ලංකා කණ්ඩායම මේ දිනවල මොන තත්වෙක සිටීදැයි සිතාගත නොහැක​. කෙසේ නමුත් නිසිකලදී නෝන්ඩි නොවී ඉවත්වීම අගය කරමි. ප්‍රශ්ණය ඔහුගේ ටෙස්ට් පිටියෙන් සමුගැනීම වෙනුවෙන් බිරිඳ අඬා වැලපෙන්නේ මන්ද යන්නයි. (බිරියක් සැමියා නිවසේ රැඳෙනවාට කැමතිය​,0
ඇයි මං තම්බි වගේද පෙන්නෙ😏 මං බ්‍රහස්පතින්දා ගෙදර එන්නෙ..එතකොට සිකුරාදට හොද අඩව්වක් අල්ලන්න තිබ්බා ආවනම්😅,0
ලාච්චුව ඇරලා දෙපාරක් වහමු...මුත්තගෙ අසනීපෙ නිට්ටාවට සනීපයි.,1
ඊයා බන්. ඕකේ මොකක්ද බන් තියෙන ආතල් එක​?,0
ඉටිම් බං උතුර ඉල්ලනසෙට් එකයි නැගෙනහිරපඉල්ලන තම්බි සෙට් එකයි අයිං කොරපා බැලුවොත් බං රනිල් පරාදයි නෙහ්,1
ජන්දෙ දිනාගන්නකං ඔහොම යයි...ඊට පස්සෙ මුනුත් ඉතින් පරණ පීල්ලටම තමයි වැටෙන්නෙ...අපි නොදන්න මොණරතැන්න...,0
ආප්ප සීන් එකනම් එක්කො කියන්න පුළුවන් උන් උන්ගේ සංවේදී තැන් දන්න හින්දා ඇබ්බැහි වෙනවා කියලා. ඒත් පිරිමි??? මටනම් අප්‍රසන්නේ බෑ බන්. මේ රට දවසින් දවස පිරිහෙනවා. ෂික් විතරක්.,0
පේනවානේ තම්බි කවදත් ඉන්නේ උන්ට වාසි පැත්තේ. එහෙම ඉදගෙන උන්ගේ ශරියාව සහ උන්ගේ බෝවීම ස්ථාවර කරගන්නවා. උන්ගේ ටාගට් එක රටේ බහුතර…,1
අනේ බොල මීමො...උඹට ගහගන්න හයියක් නැත්තං...විශ්‍රාමත් ගිහිල්ලා නම්...ගෙදරට වෙලා පවුලෙ වැඩක් කරගෙන ඉදින්...,1
පව් බන් කෙල්ලට හුජ්ජ ටිකවත් නිදහසේ කරගන්න බැරිවෙන්න ඇති. ඔච්චර අවිශ්වාසනම් මොන රෙද්දකට තියන් ඉන්නවද​. ඌ දන්නේ නැතුව ඇති කෙල්ලොන්ගේ හැටි. මාළු ටැංකියක ආරක්‍ෂාවට දාලා තිබ්බත් මාළුවෙක් එක්ක හරි පැනලා යන කෙල්ලෝ,1
මේ පරය තමයි වපුරන්නෙ,1
අවජාතක පඹ ජනාධිපති වගේම සහජීවනය ගැන පුරසාරම් දොඩෝන,1
මහින්ද තවම දන්නෙ නෑ...පොළොන්නරුවෙ හිටං අන්තිමේ ඇරියා ඇරිල්ලක් මහින්දට හතර ගාතෙන් වැටෙන්න...පාර්ලිමේන්තුවෙ බහුතරය නැති බව දැනගත්තම තමයි මහින්දට සුදු සරමෙ කහ පාටට යන්නෙ...,1
ඇයි දැන් ට්‍රෙන්ඩ් එක හයිවේ නේ. ඉතින් මහාමාර්ග ඇමතිකම් තව එකකට කඩලා අධිවේග ඇමති කියුවනම් ඇමතිත් සතුටුවෙයි. මොකද නමත් ටිකක් පොෂ් වගේනේ. ඇමති අධිවේග හික්ස්,0
ඉතිහාසය ඉදිරියේ මෙවැනි හෙළිදරවුවක් කිරීමට අවකාශය දුන් අපගේ ප්‍රණාමය පුද කල යුතුයි. පසු ගිය කාලයේ මේ රටේ ඇතිවූ…,0
සකලසිරින් පිරි සිරි ලංකාවේ නීතිය ඇති හැකි අනුව වෙනස්වන බවට කදිම උදාහරණයක් තමයි මේ...මේකිට අඩුම තරමෙ සීරීමක් හෝ නැතුව මෙච්චර කාලයක් ඉස්පිරිතාලෙ ඇදක් උඩ දපලා...රටක් වටින මනුස්සයෙක්ගෙ ජීවිතය නැති කරලා,1
විහිළුවට කියුවට ඒක ඇත්තනේද බොලොව්,0
ගෙරි හම්බයා ...,1
අරුණ ශාන්ති පුක දෙන්න ගිහින් බඩ කට පුරා ගුටිත් කාලම ඇවිත්...කොහොමද ලල් එක,1
දැන් එතකොට ජාතික රූපවාහිනියට එරෙහිව නඩු පවරාඅ තහනම් කරාවිද​?,0
පළ පළ තම්බි හු....නා තමන්ගේ වැඩක් බලාගෙන හිටු.. අපි අපේ රට ගැන බලා ගන්නම් .. අවජාතකයා,1
සිරිසේන ගමරාළ...රටම ගිණි තියලා ආයෙමත් 89 දශකයට රට අරගෙන යයිද කියලා හිතෙනවා...මම අද ටිකට් බුක් කරගත්තා කැංගරුවො ඉන්න පැත්තට....ටටා බායි මවුනි දයාබර...,1
මම මේ නිකමට දැන ගන්න බොලව් ඇහුවේ,0
අඩෝ තම්බි පරයා .. කට වහගෙන හිටු. අල්ලාහ්ගේ හොර ගැනිට අයේශට පෝලින් දානවා පරයා.. ආ අර වයසක කඩීජා ත් හොදයි හැබැයි,1
ග්ලාන්ස් කරන්න හදන්න ඇත්තෙ...ෆුල් පහරක් වදින්න ඇත්තෙ...මගෙ හොර ෆයිල් ගෙනියන්න අනිවා එන්න ඇත්තෙ......තෙල් වර්ජනයකට යයි වගේ...ඊට කලින් ගහගනිල්ලා ෆුල් ටෑන්ක්...,0
මටනම් නිකන් පිස්සු වගේ.,0
කාද යකෝ ඕසදීව ඩීප්ෆ්‍රීසර් එකෙ හිර කරල තිබ්බ පරය 👹️,1
සිරිසේනයා වගේ කෑ පතේ රීපු එකෙක් තවත් නම් නැතුව ඇති...,1
ලාබ දෙක ගත්ත එක නෙවෙයි ප්‍රශ්ණේ. කැඩුනාමත් රාජ්‍ය උත්සවයකට දාගෙන අපු එකයි අවුල​. ඊට වඩා නම්බුයි සෙරෙපුවක්වත් නැතිව ගියානම් කියලා බොල කියුවේ. කියන දේ තේරුම් ගන්න බැරිව කොහෙද අනාගතේ සුබ කරන්නේ,0
ඉතිහාසය ඉදිරියේ මෙවැනි හෙළිදරවුවක් කිරීමට අවකාශය දුන් අපගේ ප්‍රණාමය පුද කල යුතුයි. පසු ගිය කාලයේ මේ රටේ ඇතිවූ…,0
චතුරයා වගේ පිම්පියෙක් පුලුවන් දෙයක් කරන්න ඕනෙ...මූට අඩුගානෙ ඇගක් වත් තියෙනවද හරියට...මූණ දැක්කම බල්ලො බත් කන්නෙ නෑ,1
ඉතින් යකෝ අඩිය ගැලවුනානම් පොළොවේ පය ගහල නිකම් පලකෝ. ඒක නම්බුයිනේ බොල​. මූ වගේ මොඩ මූසලයෙක්.,0
එක පැත්තකින් බැලුවාම උඩතලවින්නේ තම්බි දණ ගැස්සු චරිතයක් තමා ලොහාන් කියන්නේ ..,0
සිරිසේනයා රෙදි අදින්නෙ ලැජ්ජාවටද...නෙදකින් මූ වගේ හිකනලෙක් දැක්කෙම නෑ...,1
සිරාකතාව​. ඇයි බන් ඇඳුම,0
සිංහලයාට සිංහල පක්ෂ නැතිමුත් දෙමළාට ඉලම වෙනුවෙන් පක්ෂ ඇත. තම්බියාට තම්බි වහබ්වාදය වෙනුවෙන් තම්බි පාර්ලිමේන්තුවේ ඇත. මේ…,1
නොම්බර එකේ සල්ලාලයෙක්,1
1. ශ්‍රී ලංකාව සහ චීනය අතර මිතුදම බොහෝ කල් ගත වූවකි. එය බුදුදහම සහ වෙනත් දේමත පදනම් වූ දෙයකි. අපට චීනයෙන් නොමිලේ ලැබුනු දෑද බොහෝය​. නමුත් ඉන් දියාව හා චීනය අතර කාලාන්තරයක සිට අළුයට ගිණි දැල්වේ. සිරිමාවෝ මැතිනිය මැදිහත් නොවන්නට චීනය හා ඉන්දියාව ගැටුමක් ඇතිවන්නටද තිබුණි.,0
ලෝකයටම පිළිලයක් වු මරක්කල කරණය (වහබ්වාදය) වෙන් තුරන් කළ යුතු කාලය පැමිණ ඇත. සැවොම එකයි කියමින් වෙනම ක්…,1
ඕකෙ ඇන්ටනා හයි කරගෙන කරන්නෙත් එක එකාට කඩේ යන එකනෙ...,0
2. මහරජාගේ ආණ්ඩුව වැඩි ලෙංගතුකමක් පෙන්වන්නේ පලස්තීනය සහ චීනයටයි. ඉදින් මහරජා චීන ජනපතිට නොසලකා සිටින්නේ නැත​.,0
පලයන් පරය,1
මාක් අයියා එක්ක හිටිය කෑලි 3 මතක් උනේ...,0
3. චීන ණය ආධාර සහ බොහෝ ගිවිසුම් ශ්‍රී ලංකාවට වාසිදායකව මෙම සංචාරයත් සමඟ ලැබුණි. නමුත් ඉන්දියාවට එසේ මහලොකු දෙයක් ලැබෙන්නේ නැත​. ඉන්දියාව චීනය ලංකාව වැනි රටවලට සහ ආසියාවේ සැරිසරනවාට කොහොමත් හිත හොඳ නැත​. නමුත් එය පෙන්වන්නේද නැත​.,0
රැවුල කොණ්ඩෙ කපන්න ගිහින් පොඩ්ඩක් කොටකරන්න කිව්වම ඒ පරය කොටටම කපලා 😢😭 බාබරයට හෙණගහන්නෙපැයි කරපු අපරාදෙට😢😢,1
එක සැරයක් බැඳලා පෙට්ටිය කඩාගෙන ඉන්න එකියකට රත්තරං නෙමෙයි ප්ලැටිනම් වලින් හැදුවත් වැඩක් තියේද බං...,1
3. ලංකාවට එරෙහි ක්‍රියාමාර්ග වලදීත් ලොව දෙවැනි බලවතා වන චීනය අපවෙනුවෙන් කල මෙහෙවර සහ ආගන්තුක සත්කාර වලින් ඉහල තැනක සිටින ශ්‍රී ලංකාව කවදත් මෙසේ සැලකූ අතර මෙය අවබෝධකරගත යුතුය​. සැමදේම වැරදි ලෙස නොබලමි.,0
මුරලිදරන් ගේ ඉන්ටර්වීව් සීරිස් එකේ දෙවනි එක මයුමි රහීම්ස් ගෙනාවා නම් හරි නේද යාළුවනේ. ඔලිම්පික් ප්‍රොෆයිල් එකක්නේ ඉතිං.…,0
ගණු දෙනු කියන්නෙ මේවට...,0
පාරටනම් හදන්න උපදේශකත්වය දීපු එකාගේ නම දාලා තියෙන්නේ මයේ හිතේ.,0
මේ දවස්වල කරු ජයසූරියට සද්දෙට පඩයක් ගියත් ගියත් ඉස්සර වෙලාම දුවන්නෙ තම්බියො ටික....ඒක ඉඹල හරිම හොඳයි හොඳ සුවඳයි කියල කෑ ගහනව.,1
සංගිලි විමලයා වගේ ගෙවලයෙක් හොදයි ගොන් කරත්තයක ගොනා වෙනුවට බඳින්න...මූ ඒ තරම් හරකෙක්...,1
සමරුපලක කතාව නම් ඇත්ත​. ප්‍රජාතන්ත්‍රවාදයක් නැති එක​. ඒත් ඕවා දාන්න එපා ගොසිපෝ. ඒට පස්සේ ඕක කඩලා ඔයිට වඩා ලොකුවට ආයෙත් එකක් හදලා මුන් අපේ සල්ලි වලින්ම ලොකු විවෘත කිරීමක් කරයි ආයෙමත්.,0
හම්බයා,1
මුගෙ මූණ දැක්කම පේනවා උගත් කමක් නැති තනි ගවයෙක් කියලා,1
හැම මඟුලම ලංකාවේ තියන්න දඟලන්නේ මොන පිස්සුවක්ද​? අනික වියදම් කර කර හම්බන්තොටට කොරනවා ඊට පස්සේ කරපු ඒවත් කැලේ,0
ගහප් පරය 😂,1
ගිණි ගත්ත ගමන් එන්න ලෝකයේ කිසිම ගිණි නිවන හමුදාවකට බෑ...හරකෙක් උනාට ඒ බව හැමෝටම පෙන්නන්න එපා ගවයො.,1
කථාව ඇත්ත මචන්. හැබැයි තව දෙයක්. ආයතනය වගකියනවා කියුවට එවෙලේම ලෙඩ හැදෙන්නේ නෑනේ. කවුරු පාවිච්චි කලත් ලෙඩක් ආවොත් නීතිමය පියවරක් ගන්න බෑ ලංකාවේ තහනම් නිසා. කොහොමද මාර්කටින්?,0
මෙහෙ සමහරුන්ට උනාට සව්දියේ හලාල්,0
මජර මරා රටට පිළිලයක් වේගෙන එන්නෙ...,1
මම ලින්ක් එකක් ඇති කියලා ලිපිය කියෙව්වේ. හැබැයි ගණන් දැක්කම සල්ලි පොතේ දාලා අතේ ගැහුවනම් හොඳයි කියලා හිතුනා.,0
පෙනි පෙනී සිදුවන විකිණිම සහ මිලට ගැනීම හමුවේ හුරේ දාන මොඩ ඡන්ද දායකයන් දුටුවිට .. අහෝ අප සිරබත් කෑවේ…,0
රිමාන්ඩ් එකේ අයියලා ඉන්න පැත්තට නංගිව දැම්මා නම් එක විනාඩි 10 කට...මේ කියන එකීගෙ තියෙන සියලු අමාරු හොද වෙයි කියලා මට ෂුවර්...,0
හරි හමන් මිලක් නැත​. වැඩිම මිලට විකිණෙනබව දැන්වූවාට මිල තීරණය කරනේ කවුද​? විකුණන්නේ කවුද​? විකුණූපසු මුදල් යන්නේ කොහාටද​?,0
මායි හම්සයි එක ඔපිස් එකේ වැඩ කරද්දී පොඩි සෙමින එකක් තිබ්බ. පිටින් කය්ටිය ආව. ඒකට ලස්සන මුස්කිම් කෙල්ලෙක් ආව. මම හම්සට පෙ…,0
මූ තනි ගවයා...,1
ඔව් බන් එක්කෝ කියන්න ඔනේ සෙද්ද​. මෙතන රෝසිව පට්ට බාණ්ඩයක් කරල ගොසිපා වෙන ලිපියක් දානවා මෙන්න මෙයත් එක්ක තමයි හිටියේ කියලා. ඒකත් දාන්නේ නම නොකියා හිතාගන්න විදිහට​. ගොසිපත් අපෙන් ආතල් ගන්නවා මට පේන්නේ.,0
* හිස්බුල්ලා ආවා.. හලාල්,1
පොලොන්නරුවෙ ගවයට මේවා පේන්නෙ නෑ,1
ජවිපෙ වෙස්මූණුත් ඔය ගැලවෙන්නෙ. කවුරුත් එකයි කියලා මම හැමදාම කියන්නේ ඒකයි. ජවිපේ හැමදාම විපක්‍ෂේ ඉන්නකල් වැරදි පෙන්න පෙන්න කෑ ගහන්න​,0
උඹලැ බලුමූනු අමිත්ගේ බණ අහල අන්න තව්හිද් ජමා සහ තම්බි අන්තවාදීන් සෙට් එක සෝවාන් වෙල .උඹල උන්ව හරිමගට ගත්ත නේ.. අනෙ හුකේ.. එකේක විකාර අවුස්සල වීඩියෝ දාල රට ඉන්න කොල්ලන්ගෙන් සල්ල්ලි හිඟාකනෝ.. ඒව ගසාකනෝ.. තොපිද් දැනුවත්ව හෝ මෝඩ කමට ඕ ගස්නරින්ට කඩේ යනව..,1
උඹ මොන පොන්නයෙක්ද බොල..මූණ දිහා බැලුවාම ඕනෙ හරකෙක්ට පේනවා තඩි පොන්නයෙක් කියලා...,1
