"මම දැක්ක බොහොම නිහතමානී විනිසුරෙක්. යාපනේ මිනිස්සු බහුතරේ ඉතාම හොද අය. අත්දකීමෙන් කිව්වේ,",0
"මමත් ආසම නිලියක්. තාම නම කැත කර ගත්තු නැති,",0
"අපිට සංගීතේ උගන්නන්න සුරංගනාවියෝ වගේ ටීචර්ස්ලා හිටියේ නෑ මාත්තියෝ 😓😓😓😓😓😓😓🔫 ,",0
"මහින්දගේ බඩ අත ගාපු එකෙක් මූ. දැන් නම් සොරි තමා,",1
"මොකද බන් වෙන්නේ? ඒකි ලංකාවට,ලංකාවේ මිනිස්සුන්ට ආදරෙයි. අම්මා සිංහල​. පූජාත් සිංහල කථා කරනවා. අපේ සිනමාවට සේවයක් කරනවා. හොඳ හැදිච්ච,",0
"මාත් ආසයි අහුමුළුවලින් වචන ඇද ගන්න. දැනෙන්නෙ ලියන්න... ඔයාට පුලුවන් තවත් සාර්ථක වේවා අක්කේ...🍁 ,",0
"ලොකු එක නොදී පල ලොල්ලො,",1
"ඇත්තටම මම කොත්තු ලංකාවේද නැද්ද කියලා දැනගෙන හිටියේ නෑ. මේ විකි ලින්ක් එකෙන් තමයි දැනගත්තේ ලංකාවේ කියලා. මීට කලින් මම අහල තිබ්බේ පකිස්තාන් කෑම් අක් කියලා. සමහර විට ගෝදම්බ රොටි වලින් හදන නිසා කවුරු හරි එහෙම හිතන්න ඇති. මොනවා උනත් මම ආසම කෑම​. පහුවෙනිදාට ටොයිලට් ගියේ නැත්නම් ඒකේ නියම ආතල් එකත් නෑ. අම්බානක සැර දාලා දෙන්න තිබ්බේ නිවේදකයෝ ටිකට තරු පේන්න​. මොකද සුද්දෝ සැර කන එකක්‍ යැ....,",0
"ආදරෙ නොකර ඉන්නවා කියන එක නෙමෙ කිව්වෙ. ගරු කරනවා යුතුකම් ඉශ්ට කරනවයි තමන්ගෙ අම්මට වගෙ ආදරෙ කරනවයි කියන්නෙ දෙකක් ,",0
"යකෝ...ඔය පත් කරගත්තෙ කුණු අදින්න මන්තිරියො ටිකක් නගරසභා වල ප්‍රාදේශීය සභා වල...මේකෙන් ජනාධිපති වෙනස් කරන්න බෑ....ඔන්න ඕකයි කියන්නෙ අපි..අඩුම තරමෙ රෙදි ඉස්කෝලෙට හරි පලයං කියලා යමක් කමක් ඉගෙනගන්න.,",0
"හොඳ හඬක් ,",0
"ජය වේවා !! ,",0
"ඔය කාලකන්නි ආයෙ ලං කරගත්තොත් මරාගෙ අනාගතය ඉතාම පැහැබර වේවි,",1
"මේක කියෙව්වට පස්සේ මට වෙරි වගේ. මම කල්පනා කලේ මම කීයටද බිව්වේ කියලා. හික්ස්,",0
"සෙස් බර උදෑසනක් වේවා  💦 ,",0
"මරාට විරුද්ධ චෝදනා ටික කඩිනමෙන් විභාග කරලා අදාළ දඩුවම් දුන්නා නම් අද වෙන විට මරා හාන්සියි. මේ ආණ්ඩුවට කොන්දක් තිබුනෙ නෑ ඒ වැඩේවත් හරියට කරගන්න...තූ නෙදකින්...,",1
"ඔව් බන් ගොසිප්පා දැන් අමුතුම ස්තයිල් එකකට කොටන්නේ. අනේ දෙයියනේ කියලා බලපු සයිට් එක ලඟදිම බ්ලොක් වෙයි වගේ. ලිපිය කියවලා ඇත්ත මොකක්ද නෝන්ඩියක්ද කියලා පැත්තකට වෙලා කල්පනා කොරන්න ඕනේ. එක අතකට මේ නිවුස් කියන විදිහත් හොඳයි බොල​.,",0
"අදත් හෙටත් ඉදිරියටත්........ අරගලයට ජය වේවා....... ,",0
"මේ හිමියන්ට වන්දවන්න කියලා හෙන්ඩුවෙන් කී සැරයක් ඒ සතාට අනිනවා කියලද...උපාධි පිට උපාධි ගැහුවත් සත්ව හිංසාවට අනුබල දෙනවා නම් වැඩක් තියෙනවද ඒ උගත් කමෙන්..හිමි වැපිරූ දේම අනිතිමේ අස්වැන්නට ලැබුනා..මියන් කුමාරයගෙ ඉවසීමේ සීමාව පැන්නා.,",0
"හැම රෙද්දක්ම හම්බන්තොටටම අරන් යනවා. සලකා බැලියයුතු කාරණා කිසිවක් බලන්නේ නෑ. ගුවන්තොටුපල හදද්දි අලිගැන සැලකිය යුතුයි කියුවාම​,",0
"දවස් ගානක ඉදන් නින්දක් නෑ අයියෝ 😭😭😭😭😭 ,",0
"ගෙඩි පිටින්ම පතෝල ටිකක්..මෙලෝ රහක් නෑ...,",0
"මොකටද බන් ලැජ්ජවෙන්නේ. දූෂණය කරනවා නෙමෙයිනේ. කැමෙත්තන් ගහන්න දෙන එකනේ. මුහුදේ නැව් ගියාට පාර හිටින්නේ නෑනේ. ඇයි උඹට දුන්නොත් මේක ගහපන් කියලා උඹ ලැජ්ජාවෙන් ඇඹරෙනවද​?,",0
"ඔබට ජයම වේවා! ,",0
"අනේ බොල හරක් දයාවතියො...උඹව කෝපි කඩෙන් එලෙව්වෙත් ඔය කියන මරාගෙ කාලෙම නේද...දන්න රගපෑමක් කරගෙන නොදී ඉදපං බං කිච නොවී.,",1
"වෙලාවට හිටියේ නැහැ,",0
"සුබ රාත්‍රියක් වේවා.....❤✋  කිව්වට නිදාගන්නෙ නෑනෙ නෑනෙ 🤣🤣🤣🤣🤣🤣🤣🤣🤣🤣🤣🤣🤣 ,",0
"මේ වගේ නිළධාරියෙක්ට එරෙහිව මෙහෙම තීරණ  ගන්න තුට්ටු දෙකේ කාලකන්නි නිළධාරින්ගෙ ඒවා ලාච්චුවෙ දාලා වහන්න ඕනෙ...,",1
"මරුතමා ‍හො‍දේ පල පල බන්යන්න.,",0
"සුභ රාත්රීයක් වේවා කට්ටියටම..සුභ හීනම පෙනේවා..😍 ,",0
"එළ කොල්ලෙක් තමා ඉතිං...අපි බොක්කෙන්ම සපෝට්...ඔය ඩයස් පෝරා කාරයන්ගෙ ඒවා ලාච්චුවට දාලා වහන්න ඕනෙ.,",0
"ඇත්තටම මම සතුටු වෙනව ජිනිවා වල චන්දෙ පැරදුන එක ගැන,",0
"ගරු අගමැති තුමා ණය ගෙව්වේ ඔහුගේ පොකට් එකෙන් නොව අපේ පොකට් එකේ බදු වලින් බවට අමතක නොකරන්න... ,",0
"ඔහොමම ව්‍යංගයෙන් හරි නම් දෙකත් කියලා අපේ ආතල් එක තව වැඩි කරලා දියංකො ගොසිපො...,",0
"උද්දච්ච මෝඩ සින්හල එවුන් දැන්වත් හැදෙයි,",0
"කාටද කියන්නේ මේවා 😂😂😂 ,",0
"ළමයි හදනවා නෙමෙයි බොල ඔය..හැදෙනවා...,",0
"ලන්කාව ගන විශ්වාසයක් නැ කියල රුසියවෙ එවුන්ම කියල තියෙන්නෙ කොහොමත් කල වැද්දන්ගෙ රට නෙ,",0
"පේක්ශක අපි කාටද සප් එක දෙන්න ඕනි එතකොට  ,",0
"ඇත්තටම ඩෙංගුද නැත්තං ප්‍රිය සැමියා නන්දකුමාර ආයෙමත් සවල් පාරක් දීලද කියලා මට නම් සැකයක් ඇති උනා...,",0
"නියමයි සංගා.........,",0
"අයියෝ.. එහෙනම් කරදරයක් තමයි නේද? ,",0
"උඹලා වගේ වහලුන්ට නම් සිංහයා වෙන්න ඇති...පුන්නක්කු ටිකක් පොවන්නද ?,",1
"අම'මප මෙහෙමත් ලංකාවක්,",0
"රටටම කිරි ඉතිරෙන  සුබ තෛපොංගල් දිනයක් වේවා!!!  # ,",0
"විදුරයට මලා කියන්නත් ලජ්ජා ද දන්නේ නැ,",0
"අපේ රටට නැති දෙයක් ඇති වුණා. කාලකණ්නි දේශපාලනය නිසා ආයිත් නැති වුනා.  මොනවා වුණත් සාධාරණ බදු මුදලක් ගෙවලා කරගෙන යන්න තිබුණා. බදු නොගෙවපු එකනම් වැරදි තමා.,",0
" උගන්නන්න ගිහිං ද ? ,",0
"සරනයා පව් බං. දේශපාලන හයිය නැතුව මිනිහා දැන් පන බයේ ඇත්තේ,",0
"ලමා අපචාර වලින් ලොව දිනු නබි තුමානො යන මැයෙන් රචනාවක් පලවෙනි තෑග්ග සදහා නාකි හම්බයෙක්,",1
"දෙහි ගෑවෙ නෑ අයියෝ..මේ අපෙ හාමිනේලා දෙන්නගෙ කෑමනෙ ......ඔන්න ඔහෙ දැන් මෙ නාන්න හදන්නෙ ,",0
"පර්සි අත්සන් කළා නම් ඉතින් බඩුම තමා,",0
"අෆ්ෆට හුඩු ඔව්ම තමයි. අඩේ අද දවසේ දාන සේරම කොමෙන්ට්ස් මම වරද්ද ගන්නවනේ. මඤඤඃ වෙලා වගේ,",0
"ජනවර්ගවල ආගමික ,",0
"මම ස්පාඤ්ඤෙට කැකිරි පටවන වෙලාවක උබවත් පටවන්නද ?,",0
"හරි හරි බන්ස්ලා ඉතින් බනින්න ඕනේ ඈ... අපේ ගොසිප්පනේ රට පටලවලා තියෙන්නේ. වීඩියෝ එකේ කොලිටි එකත් එක්ක බැලූ බැල්මට එහෙම පෙනුනේ නෑ. ගොසිප්පා කියලා තිබුනනේ ""මාලකගේ මෙම මෝටර් රථයේ තවත් ජායාරුප පහතින්"" කියලා. ඉතින් ටැපලුනා. පෝෂේ එකක් තමයි ගොහින් තියෙන්නේ. සමා අවසර​.,",0
"හින්දු භක්තික සැමට සුභ තෛපොංගල් දිනයක් වේවා !  - නාලක බණ්ඩාර   2019/01/15 ,",0
"ඔබාමාගේ රෙදි ගැලවුනේ හිලරි පැරදුන දවසේ. දැන් නිකන් බොරු පොයිය විතරයි. ඔහොම හිතුව පර්සිට වෙච්ච දේ කව්රුත් දැක්කනේ,",1
"ඇයි යකෝ දැන් ඉන්දියාවට අඩු ඔච්චරද​? හදපන්කෝ හිලක් ක්‍ෂීරපථයේ මෙතන අපිටත් කෙලවෙන්න​. අඩු ගාණකට හදලා ලංකාවට පාත්වෙයිද දන්නේ නෑ අඟහරු කියලා.,",0
"එසේම වේවා ,",0
"සිංහල සිනමාවට ලොකු සේවයක් මෙතුමියගෙන් ඉටු උනා. සුබ ගමන් ඔබට,",0
"කට ඇරලා හොඳට බලපන් ඇස් දෙක කටේද කියලා. ඇයි බන් තඩියට ලෝගෝ එකයි,",0
"එසේම වේවා..! ආතල්ම ලැබේවා..! 😁👊🏻 ,",0
"ලාච්චුවට දාලා වැහුවම ලෙඩේ හොද වෙයි...,",1
"බලපන් ලින්ක් එක,",0
"කාටද ? ,",0
"එළ කොල්ලෙක්නෙ...අපේ බන්දුවට තව දුසිම් භාගයක විතර දරු සුරතල් බලන්න වාසනාව ශක්තිය කික් එක ලැබේවා.,",0
"හැම එකාම එහෙම නෑ බන්. උන්ගේ පළාත් අනුව හැසිරෙන විදි වෙනස් වෙනවා. මම ඉන්දියන් සමාගමක වැඩ කරනනිසා කියන්නේ. හැබැයි බහුතරය එකයි. උඩින් මිතුරු යටින් හතුරු.,",0
"එසේම වේවා 🎉 ,",0
"සිය දිවි නසාගන්න අයට තමයි අපි වැඩියෙන්ම අනුකම්පා කරන්න ඕනි. කෙනෙක් සියදිවි නසාගන්නෙ එයාට තියෙන පීඩනය අන්තිමට පිට කරගන්න ක්‍රමයක් නැති වුණාම. කිසිම කෙනෙක් කැමැත්තෙන් එක් කරන්නෙ නෑ.  මෙයාට තිබ්බ ප්‍රශ්න මෙයා ළඟින් ආශ්‍රය කරපු අය හොඳටම දන්නවා ඇති. හැබැයි ඒ කව්රුවත් එයාගෙ හයියට ඉඳල නෑ කියල තමයි මට නම් පේන්නෙ. එක් හින්ද කව්රුත් හිතට ගන්න ඕනි තමන්ගෙ කාට හරි හිතට වද දෙන ප්‍රශ්නයක් උණාම ඒ මනුස්සයගෙ හයියට ඉන්න. ඒ මනුස්සයට හරි මාර්ගය පෙන්නන්න. එහෙම නොකර ඉඳලා පස්සෙ දුක්වෙලා වැඩක් නෑ.,",0
"අඩේ එකෙක් හයීයෙන් ඇවිල්ලා හැප්පුනානම්,",0
"මම කල්පනා කරන්නෙ අයියෝ කියන එකා කවුද කියල. හැම වක්‍යයක් ඉවරවෙද්දිම අයියෝ කියන්න පුරුදු වෙලා අයියෝ.... ,",0
"ක්‍රීඩා කරන අය දිහා බලන්න. පාසල් තරඟ වලින් දිනලා කොහොමහරි පිට රට තරඟෙකට යන්න තිබ්බොත් දහ අතේ ණය වෙලා අහල පහල මිනිස්සුන්ගෙන් ඉල්ලගෙන එහෙම නැත්නම් පාසල මුල් වෙලා සල්ලි එකතු කරල තමයි තරඟෙකට යවන්නෙ. එහෙම අතින් කයිට් කරගෙන පුරුදුවෙලා මෙඩල් එකක් ගත්තම එනව ඒකටනම් අයිතිවාසිකම් කියන්න කාලකණ්නි.,",0
"දැන් මහින්ද මාමාට සතුටු ඇති. අනේ වාසනාවන් පකිස්ථානෙයි,",0
"සුභ උදෑසනක් වේවා ප්‍රිය ක්‍රීඩාලෝලි මිතුරු මිතුරියනි...🌚 අද දවස ඔබ සැමට සාමයෙන්...කාමයෙන් පිරි දිනයක්ම වේවා!!!  ,",0
"කොහොම උනත් ක්‍රීඩකයෙක් ක්‍රීඩා කරන්නෙ රට වෙනුවෙන්. ඒක නිසා රටට කීර්තියක් අත්කරල දීපු ක්‍රීඩකයන්ට විශ්‍රාම වැටුපක් වත් හදල දෙන්න ඕනි. මොකද ක්‍රීඩාව තමයි එයාලගෙ රස්සාව. නැතිනම් හදිසියේ අනතුරකින් හරි වයසට ගිහින් හරි ක්‍රීඩාව කරන්න බැරි කාලෙකදි ඒ මනුස්සයට වහ බොන්න තමයි වෙන්නෙ.,",0
"මම කියුවේ මට දැනෙන විදිහ​. ස්වදේශිකයන්ට තහනම් කරපු එකක් එම රටේ දන්වීම් දැම්මට වැඩක් තියෙනවද​? අද කොල්ලුපිටියේ කැසිනෝ යන්නේ විදේශිකයෝ විතරක් නෙවෙයි. ලංකාවේ උන් ඕන තරම් යනවා. ඉතින් පනතකින් සම්මත වෙලා ඒක නවතින එක වරදක්ද​?,",0
"තමන්ට ගරු කරන ගැහැණියකට නිසි තැන දෙන්න ඒ ගැහැණියගේ ⁣ගෞරවය රකින්න..  එතකොට පිරිමිකම රැකේවි ❤️ ,",0
"අවුරුදු 5ක් පාර්ලිමේනතුවේ හිටපු ගොබ්බයෙකුට ජීවික කාලෙටම විශ්‍රාම වැටුපක් ගෙවනව නම් ඇයි මෙයාලට ගෙවන්න බැරි. අනික ක්‍රීඩකයො කියල ලක්ෂ ගානක් ඉන්නවයැ. 100ක් 200ක් ඇති. ඒ ටිකටවත් හරිහමන් වැටුපක් ගෙවන්න බැරිනම් වැඩක් තියෙනවද?,",0
"උඹ කියනවනම් හොර රහසේ කරගෙන යනවා කියාලා,",0
"කාටද දන්නෙ නෑ රිදුනෙ 😂😂😂 ,",0
"සක්විති නිදහස ලබා පිටව ගියා.... යකෝ පුදුම හු.... නේ.,",1
"අඩේ මට වෙලාවකට හිතෙනවා උඹ අර වෙල්හමයවත්ද කියලා. ඒ වගේ ලස්සන වචන සෙට් එකක් දෙන්නේ. නරකද නම වෙල්ගමට සුබ අනාගතයක් කියලා දාගත්තොත්?,",0
"සප්ත වර්ණ හිරු කිරණින් සප්ත ස්වර රැව් දේවා  සප්ත ගිරෙන් හිරු එනවිට මුළු ලොව ගීයක් වේවා ,",0
"මේ වගේ ළමයින්ගෙන් පළිගන්න කුහක එවුන් නම් ඕනි තරම් කැම්පස් වල ඉන්නවා. ඕනිම දේක පීඩනය දරාගන්න පුළුවන් සීමාවක් තියෙනවා. අනික මේ ළමයා හෘද රොිගියෙක්.,",1
"අපේ ඔෆිස් එකේ එකෙක් ඉන්නවා උදේ පානදර වැලක් බලලා තමයි වැඩ පටන් ගන්නේ. මට පේන්නේ ගොසිපත් ඒවගේ. ඒ මදිවට අපෙත් මෝල අවුස්සනාඅ. නරකම නෑ දවසම ප්‍රබෝධමත්ව ගතකරතෑකි.,",0
"රත්නපුර උන්ගේ අසහනේ ...අයියෝ සල්ලි... ,",1
"පිරිපුන් සහ මුහුණේ ඇති ආඩම්බර පෙනුම විය හැකියි. ඒත් පිරිපුන් බවෙන් වැඩ ගන්නා කොටස කොහොමද කිව නොහැකියි. ළඟදි කොහේ හෝ දැක්කා චරිතයට අවශ්‍ය විහට නිරුවත් විය යුතුයිද මොකක්ද එකකුත් කියලා තියෙනවා. අන්න එදායින් පස්සෙනම් අතීත කථා රඟපාල ඉවරයි දුලානියේ. ගොසිපා අන්තිම ෆොටෝ එකේ ගල පේන නිසා දැම්මේ කියලා දන්නවා. ඒත් ඊට වඩා පිරිපුන් ශරීර කූඩුව පේන එකක් දැම්මනම් මාතෘකාවට ගැලපෙයි මගෙ හිතේ. නැතිව අපේ අසහනෙට එහෙම නෙවෙයි ඕං හරිය​.,",0
"ප්‍රීතිමත් පොංගල් දිනයක් වේවා.. ,",0
"නැව ගිලුනත් බෑන් චූන් කියල ජීවත් වෙන්න ඕනි.,",0
"ඒක ඇත්ත බන්. ඛණිජ තෙල් එක කියන්නේ ලංවීම තමයි ලොකුම ණය කාරයා. ණය ගෙවලම නෑ ඒ නිසා කොහොමද ලාබ ලබන්නේ කියලා. ඒත් ඒකේ කවදාවත් තෙල් ගාණ අඩුවෙන්නේ නෑ කොච්චර ලෝක වෙළඳපළේ අඩු උනත්. එහෙමයි කියලා ලබන ලාබෙකුත් නෑ. ගෙන්නුවොත් ගෙන්නන්නේ බාල තෙල්. මේවා කවදා හදන්නද මන්දා. දූෂණය නැති රටට හිතැති පාලකයෝ ටිකක් ආවනම් මේ රට ලෝකේ පොහොසත්ම හොඳම රට වෙන්න මොනවද නැත්තේ. ඒත් එහෙම පාලකයෙක් මේ රටේ නැති එක අපේ අවාසනාව​.,",0
"විපක්ෂ නායක ගරු මහින්ද රාජපක්ෂ මැතිතුමාගේ තෛපොංගල් පණිවුඩය ,",0
"මෙහෙමයි වමෙන් ඉස්සර කරන්නෙ වමේ ඉඩ තියෙන හින්දනෙ. එ කියන්නෙ ඉස්සරහින් යන වාහනේ දකුණෙන් යන්නෙ. වාහන හරියට පාරෙ වමෙන් යනවනම් හදිස්සි මනුස්සයට දකුණෙන් ඉස්සර කරල යන්න පුළුවන්. කොළඹ ප්‍රධාන පාරවල් බලන්නකො හැටි.,",0
"චයිනිස් බඩු වලට කව්ද බන් වොරැන්ටි එන්නේ? අර ඇපල් එකට කියලා තිබ්බේ චීනෙක්. උඹලා ගණන් දීලා ෆෝන් ගන්නවා තාක්‍ෂණේ අළුත් උනාම පරණ එකේම ඉන්නවා ගාන වැඩියෙන් දීලා ගත්තු නිසා. අපි ගාණ අඩුවට බාල උණත් සුපිරිබඩු දෙනවා විසික් කරල අළුත් එකකට යන්න පුළුවන්නේ කියලා. හික්ස්.,",0
"හරි ! නියමයි .. ඒ අදහසට ගරු කරනවා සහ මම හිතන්නේ ත් වෙනස් වෙන්න ඕනි ඕක ,",0
"අනික පොලිසියෙන් හැංගිල ඉන්න එක තහනම් කරන්න ඕනි. පොලිසියට ට්‍රැපික් බයික් එකක් දීල තියෙන්නෙ ඒක ගහක් පිටිපස්සෙ තියල දඩ ගහන්න නෙමෙයි. ඒ බයික් එකේ පාරෙ එහාට මෙහාට යන්න ඕනි. එතකොට තමයි මිනිස්සු පිළිවෙලට යන්නෙ. දඩ ගහන එකෙන් වැඩක් නෑ වැරදි නැවතෙන්නෙ නැත්නම්.,",0
"(හිතෙන්:තනිකඩයට දුක නොහිතේවා),",0
"සුභ තයි පොංගල් දිනයක් වේවා වේ හා සකල ලෝ වැසි හින්දු ජනතාවට ,",0
"බටහිර ක්‍රෙම්ට කරපු අය මැරෙන්නෙ නැද්ද?,",0
