මම යෝජනා කරපු එක ගොසිපා කරනවා වගේ. හික් හික්. වැල එකයි. හික්ස්,0
විමල් කියන්නේ බුරුවන්ටත් නින්දා කරන මෝඩයෙක්,1
කැරි වැඩ කරන්න එපා ඕයි 😂,1
අනේ චුටි දුවේ ඔයාට ආයෙත් වතාවක් මේ ලෝකේ හොඳට ඉපදෙන්න වාසනාව ලැබේවා.,0
මෙයත් එක්ක ජන්දේ ඉල්ලපු ‍පොන්සේකාව හිරේට දැම්මේ මෛත්‍රී කරන්න වෙන්න ඇති. මෙයා බබා පවුනේ,0
ආතල් එකට ඕයි කිව්වේ 😂 තෝ කොහේ අපිට කැරි වැඩ කරන්නද 😂🌺,1
අනේ චුටි දුවේ ඔයාට ආයෙත් වතාවක් මේ ලෝකේ හොඳට ඉපදෙන්න වාසනාව ලැබේවා.,0
මුන්ට ලුණු දාල වෙඩි තියන්න ඔන.බලු හැත්ත,1
ඔව් ඉතින් උඹ මහා අමුම කැරි වැඩක් නේ කරේ,1
මම අද කෑවා වැඩිද මන්දන්නෑ,0
තව ටික දවසකින් කියයි ද දන්නැ මමම හිතල‍ා දණ ගහ ගත්තා කියලා........... බුවාහා..............,0
සුජිත් ගිහිල්ලා පුක දියාං මෙතන පච ගහන් නැතුව.,1
මොනවා උනත් මෝල් උනාම ආතල් එක දෙන විදිහේ වෙනසකුත් ඇතිනේ. හික්ස්. මොන සෙල්ලම දැම්මත්,0
ලහිරැ උබල වගේ මූසිලයො හින්ද තමයි ලංකාවෙී ගිතෙන් මිනිස්සු ඈත් වෙලා ඉන්නේ. උබ හිතන්නේ බූරොවො රිගින් ටෝන් එකෙන් කෝටි ගානක් හමිබ කලාට උබ හැමදේම දන්න ගීත විචාරකයෙක් කියලද!,1
පුක ඕකේ මාත් ඕකේ ඇදනම් නොට් ඕකේ 😂,0
ඔව් ඇත්ත කාලයක් අට පට්ටම බැලුවා. ඒත් ඒක සර්කස් පට්ටමක් උනා. දැන් ටීවී එකේ බලන්න එකකුත් නෑ. ඒ අතින් මේක හොඳ වැඩසටහනක්. නමත් ඉතින් වෙනසනේ,0
දැන් ඉතින් මොන කසාදද බං...මම දැක්කා සති අන්ත පුවත් පතකට මේකි කියලා තියෙනවා මේ වසරේ විවාහ වෙන්න හිතාන ඉන්නවා කියලා. ලස්සන දරු පවුලක් කඩා ඉහිරපු පව උඹ මේ සසර පුරාම ගෙවයි...මේ කථාව ගයාන් කියන මූසලයටත් අදාළයි.,1
ෆ්‍රෙන්ඩ්ස්ල මට කැරි වැඩේ කළා ඒනම්.. ඕකෙ ෆ්‍රෙන්ඩ්ස්.. වෙයිට් ඇන්ඩ් සී. 🤪🤪🤪🤪🤪🤪,1
මංජුලා තන්හාවට ඔය කරන දෙයින් අන්තිමේ වෙන්නේ මේ මනුස්සයට කෙලවෙලා,0
උඹ ඉතින් හිටියා කියලත් වැඩක් කරපු එකෙක්යැ... පර්සිගෙන් ජරාව අරන් ගහන බල්ටියක් කියලා 5 වසරෙ ළමයත් දන්නවා.,1
අනේ එපා. මහත්තුරු දාගන්නෙපා අපේ පීචං වලට. පුක කහන්න ත නියපොතු නැති උනාට අත අරින ඕකුන් නැති එකම හොඳයි,1
ගොසිප්පේ එතකොට අර උපුල් තරංග ආදර අන්දරයට මොකද උනේ? ඒක බොරුවක්වත්ද​?,0
උඹ කියන කථා ඇත්ත නම් මූට මැරෙන්නම තමයි අනින්න තිබ්බෙ...,1
පම්පෝරිනම් ගහනවා පුක කහගන්න නියපොත්තක් නැ ඒ වුනාට .😂,1
මගේ නම් අදහස​:,0
මම හිතුවෙ උඹ වෙන්න ඇති කියලා මේ බේත් ගන්න ගියෙ....,0
හුකපන් මෝඩයා,1
මහේලව ඕපනින් එවන්න ඕනේ. මොකද ෆේල් වෙච්ච හැම වෙලාවෙම මහේල ඕපන් ඇවිල්ලා ලකුණු රැස්කරලා තියෙනවා. එතකොට ප්‍රෙෂර් එකත් අඩුයි. තිරිමාන්න මහේලගේ තැන ගන්න ඕනේ. අශාන් ප්‍රියංජන් කණ්ඩායමේ ඉන්න ඕනේ. මොකද ඔහු පන්දු යැවීම සහ පන්දුවට පහරදීම සලකා බලනකොට චන්දිමාල් නැති තරමටම හොඳයි.,0
ඔන්න සිංහලෙන් ම කියන්නම්... පුක තමයි.,1
ගොසිප්පා ප්‍රසිද්ධයි. අනික ඇත්ත කතාකරන දෙයක් කවදාවත් වහන්න බෑ. කපන්න කපන්න තලේ මුවහත් එනව වගේ,0
මාත් මේ පුක වලලං මැරෙන්න හදනගමං 🤣🤣🤣🤦,1
එක්කෝ මූ මුගේ මන්ද බුද්ධික බව පෙන්වනවා,1
හොද තීරණයක්...තල් රා කට්ටක් ගැහුවම කරෝල බැදුමක් එක්ක...ආතල් කනේ බොල...,0
මාත් මේ පුක වලලං මැරෙන්න හදනගමං 🤣🤣🤣🤦,1
පිටදූවේ සිරිධම්ම කියලා බණිනවා. ඒත් මහන කරද්දි එතන තව හාමුදුරුවරු ඉන්නවා. එතකොට මේ අයත් මේකට සම්බන්ධයි නේද​? හොරු සමඟ හෙළුවෙන්. මේක සාසනය විනාශ කරන්න කරන කුමන්ත්‍රනයක් වගේ දැන්නම් මට පේන්නේ. ඒ ආකාරයේ තවත් පැටව් බෝ කිරීම අනාගතයේ අපේ රටේ බුදු දහම තුල බොහෝ ප්‍රශ්ණ ඇතිකරාවි.,1
බලහංකො රේණුකාගෙ බොනට් එක...,1
මාත් මේ පුක වලලං මැරෙන්න හදනගමං 🤣🤣🤣🤦,1
සෙල්ලම් බඩුවක් වගේ හික්ස්. ජරාවක් දුන්නනම් ඕක පට් පට් ගාල රෙජිස්ටර් කොරයි.,1
අංගොඩ ඉන්න ඕනෙ ජාතියෙ දෙන්නෙක්..,1
මාත් මේ පුක වලලං මැරෙන්න හදනගමං 🤣🤣🤣🤦,1
ඕංං යහපාලනේ... ප..... තමයි....,1
කමෙන්ට් වලින් මොනවා ඔලුප්පන්නද ගවයො..මම මට තියෙන සමාජ තත්වය වහගෙන කමෙන්ට් කරන එකෙක්...පව් නොදී තණකොළ ටිකක් කාලා උම්බෑ කියහං...මෙතන නෙමෙයි වෙන තැනක...තොපි වගේ මෙලෝ රහක් නැති අං කටුස්සො මම ඕනෙ තරම් දැකලා තියෙනවා...සුසී කිව්වම උඹට රිදුනෙ උඹේ හොර ගෑණිත් සුසී ද ?,1
මාත් මේ පුක වලලං මැරෙන්න හදනගමං 🤣🤣🤣🤦,1
උන්ගේ කණ්ඩායමකට තිසර නැති උනා කියලා පාඩුවක් නෑ. තව කොහෙ හරි මුල්ලක ඉන්න පොල් අඩියෙක් හොයා ගනීවි. ඒත් උන්ට ලංකාවට මේ වගේ තුන් ඉරියව් දස්කම් තියෙන එකෙක් ඉන්නවා දකිනකොට ඉවසන් ඉන්න බෑ. මොකද දෙකේ දෙකේ සයිසෙකට ඉඳන්,0
තොපි වගේ ගවයෝ කවදද ප්ලේන් එකක ගියේ.,1
උඹත් නිකා ඉන්න එපා පුක වැඩී කියල දාපං.,1
මේ තත්වයට පන්සල්වල හාමුදුරුවරුත් වගකියන්න ඕනේ. දැන් සමහර පන්සල් වල ඉන්න හාමුදුරුවෝ ගාථාවක්,0
මම අන්තිමට ගිය වෙලේ මගේ සහයට ආවේ තුනී ලෑල්ලක්. මම කල්පනා කලේ කව්ද මෙයාව ගත්තේ කියලා,0
ගෙ පුක කහන කහන පාරට එක එක ඒවා කරනවා,1
ඉන්දියන් කාරයෝ ගෑවුන තැන විනාසයි. මේ අයි.පී.එල් රෙද්දක් හින්දා හොඳට තිබ්බ ක්‍රිකට් ක්‍රීඩාවත් විනාස වෙලා. හැබැයිතිසර පෙරේරා මේකට සම්බන්ධයි කියලනම් හිතාගන්නවත් බෑ.,0
මුගෙ කටේ තියෙන්නෙ දේශීයත්වය,0
අපිත් ඉතින් ලොකු චරිතයක් නම් නිකම් පුක දෙනවානේ. මොකටද ? ඌ මගේ බදු සල්ලි වලින් සැප විඳින එකෙක් මිස මට සතයක්වත් දීලා තියෙන එකෙක් නෙවෙයි නේ,1
ඩිස්ලයික් වැටුනා කියලා කියන්න ඕන දේ නොකියා ඉන්න බෑ. මට ආණ්ඩුවට කඩේ යන්න ඕනේ නෑ. ඒත් ෆොන්සේකාට තනියෙන් යුද්ධෙ දිනන්න බෑ. එහෙමනම් ඔහුට ඒක කරන්න තිබ්බේ මහින්ද බලයට එන්න කලින්. අපේ මිනිස්සුන්ට තේරෙන්නේ නැත්තේ එතන​. මම කියන්නේ මොකක්ද කියල තාර්කිකව හිතනවනම් තේරේවි. මහින්ද ජනපති වශයෙන් හා ගෝඨාභය ආරක්‍ෂක ලේකම් වශයෙන් තීරන ගත්තේ නැත්නම්,0
හැම පින්තූරයකටම ඔලුව දාගෙන ඉන්න ගොබිලා කවුද ?,1
රනිල් අගමැති කරන්න පුක ඉරාගෙන කඩේ ගිය උන්ට ඌ චිචීගෙ වෙඩිමට ගිය එක හෙනම අවුල් වෙලා.. උඹල වෙන එකෙක් අගමැති කලා නම් ඌ තමා රනිල් වෙනුවට යන්නෙ.. ඒ ගියේ රනිල් නෙවෙයි ලංකාවෙ අගමැති.. මහින්ද මොනා කරන්නද බං උඹල ඌවගේ ලෝක හොරෙක් අගමැති කරගත්ත එකට.. ඒ😂😂,1
ගෝඨා ෆොන්සේකට ඡන්දෙදි උදව් කලේ නෑ. යුද්ධෙදි මහින්දට යුද හමුදාපති තෝරල දෙන්නේ ගෝඨායි. චන් ද්‍රිකාගේ කාලේ විශ්‍රාම යන්න හිටපු සෙබළෙක්ව යුද හමුදාපති කරලා උසස්වීම් ලබා දීලා සේවා කාලය දික්කරන්නේ ෆොන්සේකාගැන විශ්වාසය තියලා. මොකද ඔහුට මෙය කල හැකි බව දන්න නිසා. ඒත් ෆොන්සේකාට යුද්ධෙන් පස්සේ ලැබෙන ජනතා ප්‍රසාදයත්,0
පිස්සු නැත්තං මරු...,0
අකු දිසානායක විසින් ජවිපෙ එජාපයට පාවා දෙනව කියන අය ගොඩක් දුරට විමලාවතී පාක්ෂිකයො. බැරිවෙලා විමලාඔතියා ජවිපෙ නායකයා වුනානං පක්ෂෙ මහින්ද මහත්තයට පාවා දෙද්දි පුක උඩ දාගෙන නිදාගන්න එකයි කරන්නෙ. ඒ හින්දා යූ එන් පී ගූ...,1
ෆොන්සේකා යුධ මානසිකත්වයෙන්ද,0
මුන් මානසික රෝගීන්ද..ලෙඩ වෙලා ඉන්න එකාගෙත් තොල් ටයර් වෙලා තියෙන විදියෙන් හිතා ගන්න පුලුවන් ගංජං පප්පෙක් කියලා..,1
ජෝඩුවක් ජිගියදාද්දි ගෑනිට පඩයක් ගියා. ගැහිල්ල නවත්තපු මිනිහ ගෑනිගෙ නිකටෙන් අල්ලල හුරතලෙන්කීව මගෙ කුක්කු පැටියට බෝම්බයක් ගියා කියල. මෙහෙම දෙකතුනක්වුනාලු. වැඩේ ඉවරවෙලා දෙන්න පැත්තවැටිල ඉද්දිත් ගෑනිට පඩයක් ගියා. අනිත්පැත්ත බලාගත්ත මිනිහ අප්පිරියාවෙන් කීව ඉඳකිං හුත්ති පඩමයි අරින්නෙ,1
ඇමරිකාව ඉරාක යුද්දෙට පස්සේ සෙබළුන්ව එක පාරට ගෙදර ඇරියේ නෑ. ඔවුන් මනස හදලයි පිටත් කලේ. එදා ඔහු ජනපති උනානම් අද අප රට බොහෝ විට හමුදා පාලනයක් වගේ විය හැකියි. ඒ වගේම අද පවතින විදේශ බලපෑම මීට වඩා බලවත් විය හැකිව තිබුණි.,0
මේවනෙ යකෝ නියම බයිලා...අතේ රෝල් කියන්නෙ මෙන්න මේවට...,0
ආයෙත් අහලා. මැදිහත් වෙලා වැරැද්ද හදන්නත් හදලා,0
ඒක තමයි මම කියුවේ. ඒකට ශක්තිමත් විපක්‍ෂයක් තිබිය යුතුයි කියලා. කට විතරක් තිබ්බට වැඩක් නෑ වැඩත් තිබිය යුතුයි. ප්‍රතිපල බොහෝමයක් බැලුවාම සංධානේ උනත් ආසන ප්‍රමාණයේ අඩුවීමක් දකින්නේ. අපේ රටේ මිනිස්සු ඔය කියන තරම් මෝඩ නෑ. හරි ආණ්ඩු පක්‍ෂෙට දුන්නේ නැහැයි කියමු. කාටද දෙන්න පුළුවන් හොඳම විපක්‍ෂෙ??? මෙහිදි කරන්න ඕනේ දිනන්නේ කවුද කියල බලන එක මිසක් පක්‍ෂෙ නෙවෙයි. ගමට පළාතට වැඩක් කරන්න පුළුවන් කෙනෙක් පත්කර ගැනීමයි නුවණට හුරු. ළමා අපචාර,0
පොඩි තව් විදලා දැන් මේ මූසලයට අමාරුව සනීප ඇති.,1
අපි තුන වසරෙදි තමා සඳමාලි ටීච ඉස්කෝලෙට ආවෙ. එයා තමයි ඉස්සෙල්ලම අපේ ගම් පලාතෙ ඇහිබැම හැඩ කලේ. රවුං පුක,1
කවදත් මිනිස්සු ආණ්ඩුවලට බැන්නා. සිරිමාවගේ කාලෙ යෝජනා කල ස්වයංපෝශිත ක්‍රමයට (ඇතැම් දොස් නොතිබුනා නොවේ) අපේ ජනතාව හුරුවුනා නම් අද අප රට විදේශික භාණ්ඩමත යැපෙන්නට අවශ්‍ය නැත​. නමුත් එකල ආණ්ඩුව පෙරලා පැමිණි එ.ජා.ප​. ආණ්ඩුවට මිනිසුන් හොඳ කියුවාද? කවුරු මොනවා කියුවත් වත්මන් ආණ්ඩුව රටට වැඩක් කරනවා. ප්‍රේමදාස යුගයට පසු රටේ විශාල සංවර්ධනයක් වෙන්නේ වත්මන් ආණ්ඩුවෙන්. ඒහා සමානව සිදුවන දූෂණය වැලැක්වීමට ප්‍රභල විපක්‍ෂයක් අවශ්‍යයි. නමුත් අපේ රටේ වර්තමානයේ එවන් විපක්‍ෂයක් තිබේද​? මිනිසුන් වැදගැම්මකට නැති විපක්‍ෂයකට ඡන්දය දෙන්නේ නම් ඉන් කුමක් බලාපොරොත්තු විය හැකිද​?,0
කෝ බං වෙඩි තියනකොට කොහෙද දෙයියො හිටියෙ,0
ඔයාලා සිංගප්පූරුව මැලේසියාව පැත්තේ යනවා නම් මේ මී කැරි කාලා බලන්න. ලොකු ගාණක් නෑ. රසයි. බඩත් පිරෙනවා.,1
නැහැ. කිසිම ජාතියක සිත රිදවීම් හරි නැහැ. නමුත් ජාතීන් සිත් රිදවා ගන්නේ ඇයිද යන්න විමසා බැලිය යුතුයි. බොදුජනයා මෙතෙක් කල් අනෙක් ජාතීන්ට ගරුකර මෙරට සාමයෙන් ජීවත්වුනා. අනෙක් ජාතීන් බොදු සිද්ධස්ථාන වනසමින්,0
මෙයාට කොළඹ බිරිදක් සහ දියණියක් ඉන්නවා කියන්නෙ ඇත්තද ? ඊ නිව්ස් එකේ රෙදි ගලවලා ලිපියක් දාලා තියෙනවා,0
😂😂😂 මමත් නොදැක අහක බලං ගියා. දැන් පියුමි හංසමාලිට ගොන් බඩුව කියලා බණින ඕකුන්ම තමයි කවදා හරි ඒකි අතේ සල්ලි ගැවසිලා ඒවා ආයෝජනය කරලා දියුණු උනොත් සාර්ථක කාන්තාවක් කියලා මල් තියන්නෙත්,1
ජ​.වි.පෙට අනුව කිසිම ආගමකට ජාතියකට මුල් තැන දෙන්නේ නෑ. ජ.වි.පෙ. පහුගිය කාලේ බොදුබල සේනාවට පලු යනකම් බැන්නා. වෙනත් හාමුදුරුවන්ට බැන්නා. ඒත් රාවුෆ් හකීම්,0
අගය කල යුතු වැඩක්...හැබැයි නොබොන උන් මෙලෝ රහක් නෑ....,0
මන් මහණ වෙනව අයියෙ අම්ම ලග නිදි අයියෙ මට ගෙදර අය ආදරෙ නෑ පරණ කෙනා අතින් විතරයි ඇල්ලුවෙ ඒත් එක පාරයි සල්ලි වලට නෙවේ ආදරෙ කරේ ඔයාට ඩේටා ඔන් එකේම නින්ද ගියා කිව්වනෙ ඒ මාමගෙ පුතා ආ එ අපෙ නෑදෑයො වෙන අයිය කෙනෙක් තාත්ත ෆෝන් එකගත්ත අහුවෙන්න එපා හුත්තො ඕවා බොරු😂,1
සුබ පැතුමි!,0
ඔබට හදවතින්ම නිවන් සුව පතමි. මගේ පියතම විචාරකයා ඔබයි. ලංකාවට ආදරය කල එකම සුදු ඡාතිකයා ඔබයි.,0
පතිවත බිල්ලට දීලා ආදරේ හොයන මෝඩ කෙල්ලො අනන්තයි... පතිවත පූජාකරන්නෙ ආදරේට... එතනින් ඉවරවෙන ආදරෙන් අස්සෙ අලුත් ආදරයක් ලැබුනම ඇත්ත කියන්නෙ අවංක කමට ඒකෙන් ප්‍රයෝජන අරන් අයින් කලාම ඒකී බඩුව තව ආදරයක් හෙව්වම ඒකී පට්ටම බඩුව.. මේ කිව්වෙ අහිංසක වගේම ජීවිතේ නොහිතා වරද්දගන සමාජෙට බඩුවක්,0
ඔබ දෙපළට ජයෙන් ජය,0
ගින්දර කොල්ලො.....,0
ජාතික අනේ හුකපං කැරි පොන්නයෝ පක්ෂයේ සාමාජිකයෙකු ජවිපෙ සාමාජිකයෙකුට දැමූ කමෙන්ටුවක් පළවෙනි රූපයෙන්ද ජා. අ.හු. කැ.පො. පක්ෂයේ නායක තුමාගේ සහ ලාංජනයේ රූපයක් දෙවෙනි රූපයෙන්ද දැක්වේ.,1
මුස්ලිම් පල්ලියට ගියාම බිම ඉදගන්න පුලුවන් මිනිහට පන්සලකට ගියාම පුටුවක් ඕනෙමයි...උඩු රැවුලගෙ මාධ්‍ය සංදර්ශන වලට තවමත් මේ මෝඩ බයියො රැවටෙනවනෙ...,1
මේ අද ඊයෙ ඇටෙන් පොත්තෙන් එලියට ආපු උන්,0
එකනම් මම හොදින් දන්නවා. මේක ඉතිං දැන් දෙතුන් වතාවක් ආවනේ,0
ජනාධිපතිවරණ අනාවැකි පොරොන්දුව ඉටුකරගෙන ගිණිතියාගෙන ඉදහං ආයෙ අනාවැකි කියන්න කලින්...,0
මහත්තයො.. එ හිටියෙ කොටි අයෙත් ඔනෙ .. ලංකාවේ වෙනම රාජ්‍යයක් ඔනෙ කියලා.. එහෙ ඉදන් පුක ඉරාගෙන කෑ ගහන උන් .. නැතුව දෙමල මිනිස්සු නෙමෙ.. දෙයියනෙ යනෙ කියලා එ මිනිස්සු අපිත් එක්ක හොදින් ඉන්නවා.. ලංකාවේ යුද්දෙ තිබ්බෙ කොටි එක්ක මිසක් දෙමල මිනිස්සු එක්ක නෙමෙ.. නිකන් බොරු නොකියා ඉන්න.,0
ජල විදුලිය හොයා ගත්තු අපේ රටේ,0
ඩොක්ටර් ශිරන්ති කාලෙකට කලින් මුඛවාඩමක් එහෙම බැදගෙන එක්ස් රේ බලන ඡායාරූපයක් අපි දැක්කා...දැන් දොස්තර පට්ටම අහක දාලද...බලය නැති වෙද්දි බලහල්ලකො වෙන වෙනස්කම් හැබෑට...,0
චෛත්‍යයක් උඩ නැඟලා තම්බි ටිකක් ෆොටෝ ගහපු එක හාමුදුරුවරු දැකල නෑ තවම.. සිංහල කොල්ලෝ ටික පුක පෙන්නුවම හැදිච්ච පුකේ අමාරුව,1
මේ අවස්ථාව වෙනවිට මෙහි පෙන්වා ඇති ෆේස්බුක් ගිණුම සොයා ගත නොහැකි වුණි.,0
