ජෝඩුවක් ජිගියදාද්දි ගෑනිට පඩයක් ගියා. ගැහිල්ල නවත්තපු මිනිහ ගෑනිගෙ නිකටෙන් අල්ලල හුරතලෙන්කීව මගෙ කුක්කු පැටියට බෝම්බයක් ගියා කියල. මෙහෙම දෙකතුනක්වුනාලු. වැඩේ ඉවරවෙලා දෙන්න පැත්තවැටිල ඉද්දිත් ගෑනිට පඩයක් ගියා. අනිත්පැත්ත බලාගත්ත මිනිහ අප්පිරියාවෙන් කීව ඉඳකිං හුත්ති පඩමයි අරින්නෙ,1
ඇමරිකාව ඉරාක යුද්දෙට පස්සේ සෙබළුන්ව එක පාරට ගෙදර ඇරියේ නෑ. ඔවුන් මනස හදලයි පිටත් කලේ. එදා ඔහු ජනපති උනානම් අද අප රට බොහෝ විට හමුදා පාලනයක් වගේ විය හැකියි. ඒ වගේම අද පවතින විදේශ බලපෑම මීට වඩා බලවත් විය හැකිව තිබුණි.,0
මේවනෙ යකෝ නියම බයිලා...අතේ රෝල් කියන්නෙ මෙන්න මේවට...,0
ආයෙත් අහලා. මැදිහත් වෙලා වැරැද්ද හදන්නත් හදලා,0
ඒක තමයි මම කියුවේ. ඒකට ශක්තිමත් විපක්‍ෂයක් තිබිය යුතුයි කියලා. කට විතරක් තිබ්බට වැඩක් නෑ වැඩත් තිබිය යුතුයි. ප්‍රතිපල බොහෝමයක් බැලුවාම සංධානේ උනත් ආසන ප්‍රමාණයේ අඩුවීමක් දකින්නේ. අපේ රටේ මිනිස්සු ඔය කියන තරම් මෝඩ නෑ. හරි ආණ්ඩු පක්‍ෂෙට දුන්නේ නැහැයි කියමු. කාටද දෙන්න පුළුවන් හොඳම විපක්‍ෂෙ??? මෙහිදි කරන්න ඕනේ දිනන්නේ කවුද කියල බලන එක මිසක් පක්‍ෂෙ නෙවෙයි. ගමට පළාතට වැඩක් කරන්න පුළුවන් කෙනෙක් පත්කර ගැනීමයි නුවණට හුරු. ළමා අපචාර,0
පොඩි තව් විදලා දැන් මේ මූසලයට අමාරුව සනීප ඇති.,1
අපි තුන වසරෙදි තමා සඳමාලි ටීච ඉස්කෝලෙට ආවෙ. එයා තමයි ඉස්සෙල්ලම අපේ ගම් පලාතෙ ඇහිබැම හැඩ කලේ. රවුං පුක,1
කවදත් මිනිස්සු ආණ්ඩුවලට බැන්නා. සිරිමාවගේ කාලෙ යෝජනා කල ස්වයංපෝශිත ක්‍රමයට (ඇතැම් දොස් නොතිබුනා නොවේ) අපේ ජනතාව හුරුවුනා නම් අද අප රට විදේශික භාණ්ඩමත යැපෙන්නට අවශ්‍ය නැත​. නමුත් එකල ආණ්ඩුව පෙරලා පැමිණි එ.ජා.ප​. ආණ්ඩුවට මිනිසුන් හොඳ කියුවාද? කවුරු මොනවා කියුවත් වත්මන් ආණ්ඩුව රටට වැඩක් කරනවා. ප්‍රේමදාස යුගයට පසු රටේ විශාල සංවර්ධනයක් වෙන්නේ වත්මන් ආණ්ඩුවෙන්. ඒහා සමානව සිදුවන දූෂණය වැලැක්වීමට ප්‍රභල විපක්‍ෂයක් අවශ්‍යයි. නමුත් අපේ රටේ වර්තමානයේ එවන් විපක්‍ෂයක් තිබේද​? මිනිසුන් වැදගැම්මකට නැති විපක්‍ෂයකට ඡන්දය දෙන්නේ නම් ඉන් කුමක් බලාපොරොත්තු විය හැකිද​?,0
කෝ බං වෙඩි තියනකොට කොහෙද දෙයියො හිටියෙ,0
ඔයාලා සිංගප්පූරුව මැලේසියාව පැත්තේ යනවා නම් මේ මී කැරි කාලා බලන්න. ලොකු ගාණක් නෑ. රසයි. බඩත් පිරෙනවා.,1
නැහැ. කිසිම ජාතියක සිත රිදවීම් හරි නැහැ. නමුත් ජාතීන් සිත් රිදවා ගන්නේ ඇයිද යන්න විමසා බැලිය යුතුයි. බොදුජනයා මෙතෙක් කල් අනෙක් ජාතීන්ට ගරුකර මෙරට සාමයෙන් ජීවත්වුනා. අනෙක් ජාතීන් බොදු සිද්ධස්ථාන වනසමින්,0
මෙයාට කොළඹ බිරිදක් සහ දියණියක් ඉන්නවා කියන්නෙ ඇත්තද ? ඊ නිව්ස් එකේ රෙදි ගලවලා ලිපියක් දාලා තියෙනවා,0
😂😂😂 මමත් නොදැක අහක බලං ගියා. දැන් පියුමි හංසමාලිට ගොන් බඩුව කියලා බණින ඕකුන්ම තමයි කවදා හරි ඒකි අතේ සල්ලි ගැවසිලා ඒවා ආයෝජනය කරලා දියුණු උනොත් සාර්ථක කාන්තාවක් කියලා මල් තියන්නෙත්,1
ජ​.වි.පෙට අනුව කිසිම ආගමකට ජාතියකට මුල් තැන දෙන්නේ නෑ. ජ.වි.පෙ. පහුගිය කාලේ බොදුබල සේනාවට පලු යනකම් බැන්නා. වෙනත් හාමුදුරුවන්ට බැන්නා. ඒත් රාවුෆ් හකීම්,0
අගය කල යුතු වැඩක්...හැබැයි නොබොන උන් මෙලෝ රහක් නෑ....,0
මන් මහණ වෙනව අයියෙ අම්ම ලග නිදි අයියෙ මට ගෙදර අය ආදරෙ නෑ පරණ කෙනා අතින් විතරයි ඇල්ලුවෙ ඒත් එක පාරයි සල්ලි වලට නෙවේ ආදරෙ කරේ ඔයාට ඩේටා ඔන් එකේම නින්ද ගියා කිව්වනෙ ඒ මාමගෙ පුතා ආ එ අපෙ නෑදෑයො වෙන අයිය කෙනෙක් තාත්ත ෆෝන් එකගත්ත අහුවෙන්න එපා හුත්තො ඕවා බොරු😂,1
සුබ පැතුමි!,0
ඔබට හදවතින්ම නිවන් සුව පතමි. මගේ පියතම විචාරකයා ඔබයි. ලංකාවට ආදරය කල එකම සුදු ඡාතිකයා ඔබයි.,0
පතිවත බිල්ලට දීලා ආදරේ හොයන මෝඩ කෙල්ලො අනන්තයි... පතිවත පූජාකරන්නෙ ආදරේට... එතනින් ඉවරවෙන ආදරෙන් අස්සෙ අලුත් ආදරයක් ලැබුනම ඇත්ත කියන්නෙ අවංක කමට ඒකෙන් ප්‍රයෝජන අරන් අයින් කලාම ඒකී බඩුව තව ආදරයක් හෙව්වම ඒකී පට්ටම බඩුව.. මේ කිව්වෙ අහිංසක වගේම ජීවිතේ නොහිතා වරද්දගන සමාජෙට බඩුවක්,0
ඔබ දෙපළට ජයෙන් ජය,0
ගින්දර කොල්ලො.....,0
ජාතික අනේ හුකපං කැරි පොන්නයෝ පක්ෂයේ සාමාජිකයෙකු ජවිපෙ සාමාජිකයෙකුට දැමූ කමෙන්ටුවක් පළවෙනි රූපයෙන්ද ජා. අ.හු. කැ.පො. පක්ෂයේ නායක තුමාගේ සහ ලාංජනයේ රූපයක් දෙවෙනි රූපයෙන්ද දැක්වේ.,1
මුස්ලිම් පල්ලියට ගියාම බිම ඉදගන්න පුලුවන් මිනිහට පන්සලකට ගියාම පුටුවක් ඕනෙමයි...උඩු රැවුලගෙ මාධ්‍ය සංදර්ශන වලට තවමත් මේ මෝඩ බයියො රැවටෙනවනෙ...,1
මේ අද ඊයෙ ඇටෙන් පොත්තෙන් එලියට ආපු උන්,0
එකනම් මම හොදින් දන්නවා. මේක ඉතිං දැන් දෙතුන් වතාවක් ආවනේ,0
ජනාධිපතිවරණ අනාවැකි පොරොන්දුව ඉටුකරගෙන ගිණිතියාගෙන ඉදහං ආයෙ අනාවැකි කියන්න කලින්...,0
මහත්තයො.. එ හිටියෙ කොටි අයෙත් ඔනෙ .. ලංකාවේ වෙනම රාජ්‍යයක් ඔනෙ කියලා.. එහෙ ඉදන් පුක ඉරාගෙන කෑ ගහන උන් .. නැතුව දෙමල මිනිස්සු නෙමෙ.. දෙයියනෙ යනෙ කියලා එ මිනිස්සු අපිත් එක්ක හොදින් ඉන්නවා.. ලංකාවේ යුද්දෙ තිබ්බෙ කොටි එක්ක මිසක් දෙමල මිනිස්සු එක්ක නෙමෙ.. නිකන් බොරු නොකියා ඉන්න.,0
ජල විදුලිය හොයා ගත්තු අපේ රටේ,0
ඩොක්ටර් ශිරන්ති කාලෙකට කලින් මුඛවාඩමක් එහෙම බැදගෙන එක්ස් රේ බලන ඡායාරූපයක් අපි දැක්කා...දැන් දොස්තර පට්ටම අහක දාලද...බලය නැති වෙද්දි බලහල්ලකො වෙන වෙනස්කම් හැබෑට...,0
චෛත්‍යයක් උඩ නැඟලා තම්බි ටිකක් ෆොටෝ ගහපු එක හාමුදුරුවරු දැකල නෑ තවම.. සිංහල කොල්ලෝ ටික පුක පෙන්නුවම හැදිච්ච පුකේ අමාරුව,1
මේ අවස්ථාව වෙනවිට මෙහි පෙන්වා ඇති ෆේස්බුක් ගිණුම සොයා ගත නොහැකි වුණි.,0
නෙදකින්...මුගෙ අර තඩියං දුවලා දෙන්නගෙන් එකෙක් අර ගොබ්බ නාමලයගෙ කරේ එල්ලන්න කියන පිම්පි කථා කවුද බං අහන්නෙ...,1
මෛත්‍රීපාල සිරිසේන නම් රියල් පොන්නයෙක්. මත්ද්‍රව්‍ය මඩලන්න විධායක බලතල තියෙද්දි,1
අතර ඒහා සමාන වෙනත් නමකින් පමණක් ගිණුමක් සොයාගත හැකි වුණි.,0
වෙසක් ගං වතුරටම යටවෙලා යන්නෙ නැතිවෙන්න මේ වගේ දේවලුත් අතරින් පතර හෝ තිබිය යුතුයි.,0
මල්ලී උඔව කොන් කරද්දී මං හිතුව උඔ පොඩි එකෙක් එච්චර තේරුමක් නැතුව කියවනවා කියලා එත් මෙකේ උන් උඔ ගැන කිව්ව ඒව හරි උඔලා වගේ උන් ට්‍රෙන්ඩ් වෙන්න ගැහැණියක් ට බඩුව කියන්න පුලුවන් උබේ අම්මා ට හරි නංගිට කවුරු හරි එහෙම කිව්වොත් කට වහගෙන පලයන් හොදේ මොකද උනුත් ට්‍රෙන්ඩ් වෙන්න එහෙම කියන්නේ,1
එහෙම උනොත් සුපර් ගර්ල් වෙලා දැන් පෙන්නනවාට වැඩිය වැඩ පෙන්නන්න වෙයි කියලා බයේ වෙන්න ඇති හික්ස්,0
මූ හෙන කයිය ගැහුවට රට පෙරලන්න වගේ...අඩි 4 ක වතුරක යන්නත් ජැකට් අදින තාලෙ පිම්පියෙක්...කාලෙකට කලින් තමන්ගෙ හොර ගෑණිගෙ මිනිහගෙ කකුල කැඩෙන්න පොල්ලෙන් ගැහුව අවලමෙක් රොජර් කියන්නෙ...අවලමුන් හැමෝම එකට එක්වුන පක්ෂයට කියන නම තමයි ජාතික නිදහස් පෙරමුණ...,1
! පොන්න රනිලෝ තෝ බුද්දාගම දියුණු කරනවලු බුද්දාගම කවුරැවත් දියුණු කරන්න බිස්නස් එකක් නොවේ මින්සුන්ගේ සර්දාව අනුව ගොඩ නැගුන ආගමක් තොගේ බොරැ පංපෝරි නැතිව හිටු,1
මටනම් හිතෙන්නේ මේක ප්ලෑන් කරලා කරපු දෙයක් (චීවරධාරියා නිවැරදියි කිය්තනවා නෙවෙයි). කෙල්ලගේ කොමෙන්ට් එක දැක්කාම​,0
තව මාස දෙකක් පෑයුවාම ගං වතුර ගැලුවෙ ඉන්දියාවෙද කියලා අහන රටක් ළමයො මේක...,0
අහ් දැන් දැක්කේ. ඔයා ඔය දාලා පොටෝ දෙක ගහපු උන් දෙන්නා මගේ යාළුවෝ. උන් මේක දැක්කා නං පුක හපාගෙන මැරෙයි ඕයි. 🤦🏿‍♂️,1
බ්‍රෙෂියර් එක ටිකක් ගණන් එකක් වගේ නේද​? ඒක නිසා වෙන්න ඇති එළියේ දාගෙන ඉන්නේ. බලන්න තියෙන මල් වැඩ ටිකම​,0
අනේ පව් නොදී වැඩක් බලාගනින්...,0
රෙද්ද ඉස්සුවේ සල්ලි වලටද,0
ඒ කියන්නේ ඒ ෆොටෝස් හදපුවා නෙවෙයි ඇත්ත කියලාද​?,0
බෙදීම කෙසේ වෙතත්...ගැසීම නම් තදටම ගියාලු...මැදමුලනෙ එකෙක් කිව්වෙ...,0
හැම එකාටම සර් ගාගෙන හෙන ශාස්ත්‍රීය විදියට හිට් වෙන්න හදපු එකෙක් උන්නා පස්සෙ ඌත් සාමාන්‍ය ට්‍රැක් එකට වැටුනා දැන් ඌ වැඩකරන්නෙ ඇම්බැක්කෙ ඕ ඕ එක එකාගෙ කැටයම් කපනවා. තව පොඩියට ලොකු තැන් වලට පුක දෙනවා හිට් වීම උදෙසා... අපිට උන්ගෙන් ආතල් ගන්න එපා කියලද කියන්නෙ 😂🔫,1
මහණ උනාට පස්සේ ලඟදි ගත්ත ඒවා කියලද​? ගොසිප්පෝ පොඩ්ඩක් පැහැදිලි මදි. මට වටහුනේ නම් ඒවා ළගදි ගත්ත ඇත්ත ඒවා කියලයි.,0
ශෝක දිනය අයින් කලත් නැතත් මිනිස්සු ඕවට අනුගත වෙන්නේ නැ. ඒ නිසා තමා එක අයින් කරන්න කියන්න ඇත්තේ.,0
පෝයට යන්නේ සිල් ගන්න මහමෙව්නාවේ ඇවිල්ලා දෙන්නේ සත්තුන්ට පොලු වලින්..😂 අම්බේ සීලේ..රෙද්ද පල්ලේ බේරනවා පූසට කවුරු හරි ගහලා ඌ මැරුණා අද කවුද කරේ කියලත් දන්නවා.වරෙන්කෝ හුත්ති අද සිල් ගත්තා කියාගෙන.8 සීලෙම කියාදෙන්නම් මං.. #පට්ටෟත්ති,1
අඩේ බලාගෙන ගියාම බාගෙට බාගයක්ම සිල්වාලානේ හික්ස්,0
අස්සයොත් දුක් වෙනවලු මේ ටිකේ..,0
හැම එකාටම සර් ගාගෙන හෙන ශාස්ත්‍රීය විදියට හිට් වෙන්න හදපු එකෙක් උන්නා පස්සෙ ඌත් සාමාන්‍ය ට්‍රැක් එකට වැටුනා දැන් ඌ වැඩකරන්නෙ ඇම්බැක්කෙ ඕ ඕ එක එකාගෙ කැටයම් කපනවා.තව පොඩියට ලොකු තැන් වලට පුක දෙනවා හිට් වීම උදෙසා... අපිට උන්ගෙන් ආතල් ගන්න එපා කියලද කියන්නෙ 😂🔫,1
හාමුදුරුවන්ට ලේ එන්න පහර දෙන ධර්ම චක්‍රය හිසේ සහ අතේ පැළඳි පොලීසියක් ඇති රටේ,0
හරකෙක් කියලා මරන්නද බං.,1
ෆයන්න කික්කි අල් නයන්න ගෙල් යන්න ෆකින් හෙල් හුත්තො! 😂😂😂👌💯🔥,1
මුදල් යහමින් ඇති උන් බඩු ගසති. ලස්සන කෙල්ලෝ උන් පසුපස ගොස් උන්ට අල්ලයි. ඌ ගියපසු තවත් එකෙක්ට උස්සයි. අපි උන් ගැන ලිපි කියවයි. කොමෙන්ට් කොටයි. අත හම යයි.,1
තොගෙ පොට අහුලාගෙන වර වැටුන තැනකින් මෝඩ හරකා,1
ටික මකලා හුත්තො 😂,1
මුදල් යහමින් ඇති උන් බඩු ගසති. ලස්සන කෙල්ලෝ උන් පසුපස ගොස් උන්ට අල්ලයි. ඌ ගියපසු තවත් එකෙක්ට උස්සයි. අපි උන් ගැන ලිපි කියවයි. අත හමයයි,1
මොකද කියන්නේ අපි හදමුද සංගමයක් ?,0
ඔව් යකෝ.දැන් කනවැල අල්ලන් යන්නේ.😂 ඇහ කන වෙලා කන කට වෙලා කට පුක වෙලා පුක ....,1
ලංකාවෙත් වෙන දේවල් වල හැටියට මෙහෙත් මලමිනි නැගිටියි ලගදීම,0
ලොකු එක නොදී පල මුසලයා,1
වට්ටක්කා පලු වගේ පුක නොකියා මාරි පෙට්ටිය වගේ පුක කියන්න තිබ්බ,1
උඹ කවුද යකෝ එහෙම කියන්න උඹත් මුස්ලිමි ප..........කින් ආපු එකෙක්ද,1
අල්ලපු ගෙදර ලොල්ලට වගේම ලොල් පෙනුමක් මුට තියෙන්නේ,1
කෝ හුත්තො මේ කීබෝඩ් එකේ යන්සෙ?,1
උඹ එහෙනමි මුස්ලිමි එවුන්ටම දිදි හිටපන්,1
මිනිහෙක් මරලත් මේ ගෝතයා හිරේ ගිහිල්ල නැ. පේනවනේ ඒ කලේ තිබ්බ යහපාලනේ,1
කැරි පුකක්නේ ඕයි ඕක. 😂😂😂,1
ඔයාගේ අදහසට මම එකගයි,0
දැන් ඉන්නේ කෙල්ලෝ නෙමෙයි නැන්දම්මලා,0
වේසි වගේ දොඩවනවා ඕයි ඌ 😂,1
අනික ඔයාලග් අදහස් දැක්විම විශ්ස්ඨයි ජය වෙිව‍ා,0
ලොකු එක නොදී පල ගෙවලයා...,1
දැන් නම් මේ හුත්ත එපා වෙලා තියෙන්නේ,1
සමතයකටා පත්කරනවනම් ඉතින් හොඳ ගානක්වත් ඉල්ලගත්තේ නැත්නම් වැඩක් නෑ. අනිවාර්‍යයෙන් වීඩියෝ එක ලීක් වෙන්නේ නැති එක අතුලත් වෙනව ඇති. මෙයාට දුක හිතිලද​,0
බැසිලා ඇතුලෙ ඉන්නකං මූට පපුවෙ අමාරුව...එළියට ආව වෙලාවෙ ඉදන් කිසිම ලෙඩක් නෑ..ලංකාවෙ නීතියෙ තියෙන මේ වගේ හිල් වහලා මුන් වගේ කාලකන්නින්ට දැඩි දඩුවම් දෙන්න ඕනෙ...,1
මොකට බය වෙනවද ?..මුන් හොදයි බං හරක්ගෙ පුක අස්සට අත දාල ගොම ටික එලියට ගන්න 😂,1
ඇතැමුන් ඉතා සතුටින් සිටින අතර තවකෙක් අපාදුක් විඳිති. ඇතැමෙක් විහින් දුක් විඳින අතර තවකෙක් බලෙන් සතුටින් වෙසෙති.,0
ලොකු එක නොදී පල ගෙවලයා...,1
වැදගත් විදියට පුක කියන්නේ එහෙමයි. 🤭,0
බහුතරය දුක් විඳින අතර සුළුතරය සැප විඳිති. සංගණන දුක පමණක් දකින අතර පාලකයෝ සතුට පමණක් දකිති.,0
ඔයත් හැඩයි..මම ඔයාගෙ බඩ උඩට නැග්ග වෙලාවට...නෝටියා ඔයා...,0
මගෙ පුක ට්‍රෙන්ඩ් වෙනව මම දන්නෙත් නෑ 😂,1
කවුරු මොනවා කියුවත්,0
රංගෙ...කියලා එස් බී කියන විදියට එස් බී කියන්නෙ තනි ලොල්ලෙක් කියලා ෂුවර්...අනිවා...,1
මගෙ පුක ට්‍රෙන්ඩ් වෙනව මම දන්නෙත් නෑ 😂,1
වැඩ අරිලා ගෙදර ගිහින් බැලුව එකම නාට්‍යය (බලන්න හොඳ වෙන එකක් නැති හින්දා). දැන්වීම් යන එක වැඩිවුනාම ඉවසගෙන ඒත් නාට්‍යය බැලුවා. දැන් ඒකත් නැතිවෙයි වගේ.,0
පොළොන්නරුවේ පොළොවෙන් උපන් දේශප්‍රේමියා මේ වෙලාවෙ රට අවුලෙන් අවුලට ඇදගෙන ගොස් ඇති බවට කිසිම රහසක් නෑ...මරා තමන්ගෙ ගොඩ වැඩිකරගන්න මේ වෙලාවෙ ඕනෑම කොන්දේසියකට යටත්ව කස්ටිය ගන්නවාට කිසිම සැකයක් නෑ...එවැනි වටපිටාවක එහි වාසිය හකීම්,0
බිලි ගන්නෝ 😂 ඊයේ ෆෝම් කර එකා වේසි වගේ තාම කියවනෝ,1
අර දයාසිරි පනින්නේ නෑ කියලා පැරදිලා හෙලුවෙන් දුවපු එකා වගේ වෙයිද දන්නේ නෑ.,1
මම කලබල වෙලා බැලුවෙ ගෑණු ටික පෝලිමක් වත් දාලද කියලා....හැක් හැක්...,0
කොණ්ඩෙ කපන්න ආව. කැරි පෝලිම ☹️,0
