ඩීසල් අඩුවීමේ ප්‍රතිශතය බැලුවාම 16% ක් විතර​. බස් ගැමුණු අඩු කරන්නේ 8-10%ත් අතර​. මේ දවස්වල උන් දුවන්නෙත් පරණ ඩීසල් වලින් වෙන්න ඇති. ඩීසල් වැඩි වුනොත් පහුවෙනිදම මුන් වර්ජනේ. මේවා පැහැදිලි කලාම සමහර උන් බණින්නේ බස් ගැමුණුට නෙවෙයි මහින්ද ගොට්ටෝ කියලා අපිට​. ඇයි බන් ආණ්ඩුව අඩුකරපු දෙයින් වාසිය මහජනතාවට එන්නේ නැත්නම් මොකටද​?,0
සිරසත් එක්ක ඔය බලු වැඩේ කරනවට වැඩිය හොඳයි වැල්ලට ගිහිල්ලා මරික්කාර්ට පුක දීපන්''-සන්නස්ගල | මාධ,1
අනේ බොල ගං හිවලො...උඹලගෙ උඩු රැවුලට අරින්න ලෝක නායකයො ආවෙ නෑ....අසූචි ගොඩක් කියලා දන්න නිසා...අන්තිමට ඒලියන්ත වෙදයි...සුමනදාසයයි තමයි නියම ඇරිල්ල ඇරියෙ...අරින්න බෑ කියලා උඹ පාරම් බෑවට ඔය හතර ගාතෙ දාලා වැටෙන්නම උන් දෙන්නා ඇරියෙ...,1
චීන ආයෝජනයක් මිස මෙය රටට බරක් නොවේ. රටේ සංවර්ධණයට මහත් රුකුලක්. එකම ගැටළුව පාරසරික හානියක් වනවාද යන්නයි. කෙසේනමුත්,0
අනේ හුකන්නෝ!!! ක්‍රිකට් ගහනව නම් ක්‍රිකට් ගහන් හිටපල්ලා පුක දීගෙන හැමිනෙන්නේ නැතුව... තොපේ අම්මගේ රෙද්ද... කලු සල්ලි කිව්ව…,1
හේවගේ මාමට වඩා හොදට ඔය පවුල ගැන මම දන්නවා...අර්ජුන කියන්නෙ ඔලුව ඉදිමුන උගත් කමක් නැති මිනිහෙක්...ක්‍රීඩාවෙන් ලැබුන කීර්තිය විතරයි තියෙන්නෙ. ඔය පවුලෙ හොදයි කියන්න පුලුවන් කනෛකුට ඉන්නෙ සංජීව විතරයි..බියර් ඒජන්සි කෙරුවාව ගැන ඔයා නොදන්නවා වගේ....එතකොට මහ ඇමති කාලෙ කප්පං ඉල්ලුව ඒවා...ඒවත් ඔයා දන්නෙ නැතුව ඇති...දැන් බලන්න සමදරා කොහෙද ඉන්නෙ කියලා...එතකොට වරාය ඇතුලෙ සම්බාහන සේවය...කොච්චර දේවල්ද අනේ...පව් ඔයා බබා...,0
අනේ පල හුත්තා ජයා,1
අපෙ බැල්ලි නැට්ට වනනකොට ඇතිවෙන චාලක ශක්තිය,0
අදාළ නෑනෙ ගං හිවලො....,1
මල්ලි ඔයාව අදටත් මතක් වෙනවා ඔයාව බෙිරගන්න එයාගේ අයියා මොන තරමි මහන්සි වුනාද කියලා ඔයා හොදටම දන්නවා මගේ මල්ලි,0
අනේ හුකන්නෝ!!! ක්‍රිකට් ගහනව නම් ක්‍රිකට් ගහන් හිටපල්ලා පුක දීගෙන හැමිනෙන්නේ නැතුව... තොපේ අම්මගේ රෙද්ද... කලු සල්ලි කිව්ව…,1
මේකෙ හැටියට නරකම නෑ....එක තරුවක් තියෙනවා...නැනෝ එකට සහ ගොඩාක් ඉන්දියන් වාහන වලට තනි තරුවත් නෑ...,0
1. නඩුවේ වර්තමාන තත්වය කුමක්ද​?,0
අනේ හුකන්නෝ!!! ක්‍රිකට් ගහනව නම් ක්‍රිකට් ගහන් හිටපල්ලා පුක දීගෙන හැමිනෙන්නේ නැතුව... තොපේ අම්මගේ රෙද්ද... කලු සල්ලි කිව්ව…,1
මං දන්නවනෙ ඩිලා අයියා...ඔය කථා පල් බොරු කියලා..ඒකනෙ අපි වැඩිය කැළඹුනේ නැත්තෙ...අනික මංජුලා අක්කා පෙරේදා හම්බවෙලාත් මට ඔය ගැන කිසිම දෙයක් කිව්වෙත් නෑ. මල්ලි ඩිල් අයියට බැටින් පිච් එකක් අහුඋනොත් වයසට ගියා කියලා නෑ හොදට නෙලනවා කියලා කිව්වෙ. ඒ කථාවෙන් මම දැනගත්තා ඩිලා අයියා දැන්ම අයින් වෙන එකක් නෑ කියලා.,0
2. දැන් ඔය බස්නැවතුම ඔහොම්මම ගලවලා අළුත් තැනට ගෙනියන්න බැරිද​? ඒ සඳහා ඇත්ත වියදම කීයද​?,0
පළමු වර බොටම් පුක,0
ඉතාම අගය කරනවා..අපේ රට ජාත්‍යන්තරය ඉදිරියේ මරාගෙ මජර ආණ්ඩුව කාලෙට වඩා යම් පිළිගැනීමකට ලක් වෙලා තියෙන බව මෙවැනි දසුන් වලින් මොනවට පැහැදිලි වෙනවා. මේ වගේ කාර්යයක නිරත වෙන්න මේ සෙබලුන්ට සහ ඔවුන්ගේ ඉහළ නිළධාරීන්ට තියෙන නිහතමානීකමත් අගය කල යුතුයි.,0
3. බස් නැවතුම එතන අලංකාරයට සුහද කථාවට තැනක් බවට පත් කරයිද​?,0
පුක පොලවෙ ගහගන්න හිතිල බං තියෙන්නෙ,0
බඩු ලාල් මේ ඉන්නෙ කොල්ලො...ඇත්තටම මේ ගැටලුව බොහොම මානුෂීය එකක්...මේ කාන්තාවො කවුරුවත් තමන්ගෙ සතුටට මේ රැකියාව කරන්නෙ නෑ. හොදට හොයලා බැලුවොත් වයසක දෙමාපියන්ට සලකන්න,1
4. ආස්චර්‍ය්‍ය පෙනෙනවා සමඟම ආස්චර්‍යයේ බස් නැවතුම හැඟවී ගොස් ඇත​,0
ඔයා මොන බඩුව ගැහුවාත් ඔච්චර තමා ඉතිං😂,1
පල පල ඩෝ...අපි කොහෙද දුන්නෙ...උගෙ ගොං කථා කියන්න කියන්න ගොං ජෝනා තවත් ෆෝම් වෙනවා.,1
5. විමල්ට දැන් බස් හෝල්ට් දෙකක්ම ලක්‍ෂ 31 ගණනේ සාදා තව තවත් ආස්චර්‍යයන් පෙන්විය හැක​.,0
ඇමතිකම් ගන්න ඉන්න උන් ඇමතිකම් ගන්නෙ නැතුව පනින උන්ට ඇමතිකම් දීල කට පුක වහන් ඉන්නව වගේ වැඩක් 😂😂,0
වාහනේ හොදයි...අධිවේගේ දුවන්න බැරි වෙයි නම කාර් නොවන නිසා...3 වීල් ටැක්සි ඔක්කොම අයින් කරලා මේ කාර් එක දාන්න ඕනෙ...එතකොට නගරෙ අලංකාරෙටත් පොඩි හරි දායකත්වයක් එනවා...වටිනාම දේ තෙමෙන්නෙ නැතුව අපේ සාමාන්‍ය ජනතාවට යන්න තියෙන හැකියාව. මට හිතෙන විදියට මේ වාහනේ අවම ලක්ෂ 8 ක් වත් වෙයි.,0
මම හිතුවා ගොසිප්පව උස්සලවත්ද කියලා. ඊයේ දවල් ඉඳන් මාත් දහ පාරකට වැඩිය ආවා. අද දවල් නිකන් මොකක්ද අඩුයි වගේ. වස කම්මැලියි. ගොසිපෝ සිරාවට උඹ නැති උනාම පාළුයි බන්. වෙලාවට ෆේස්බුක් එක තිබ්බා නැත්නම් මට මෙලහකටත් සාංකාවට උණ අරන්. (ජෝක් එකට වගේ කියුවට මේක තමයි ඇත්ත බන්),0
රැවුල තියෙන පොන්න වඩ කරන උන් එතකොට?,1
හරකෙක්ගෙ ස්ටේටස් වලට පබ්ලිසිටි දෙන්න එපා බං තවත්...,1
ඒක ඇත්ත. රටේ අගමැතිගේ හැටිඔ දැක්කම​,0
ලෝගුව අස්සෙං පුක පෙනුනද? වලාකුලු අස්සෙං හඳ පේන්නා වාගේ...,1
ඕවා මොනාද බං....දුවෙක් ඉන්න ධර්ම ශ්‍රී මුණසිංහත් තමන්ගෙ දුවගෙ වයසෙ කෙල්ලන්ගෙ රෙදි ගැලෙව්වෙ උගෙ ෆිල්ම් වල.,0
නොදන්න හින්දා කියන්නේ,0
පුක වෙනුවෙන් කෑම...,1
රිවිර දැන් විකිනෙන්නෙ ගොඩාක් අඩුවෙන්..මරා තමයි පඩි ගෙවන්නෙ වැඩ කරන උන්ට...,0
බැලුම් ගලේ මේ කථාව මම ඇහුවා. වසන්තිගේ කථාවත් ඇහුවා. සමහර වෙලාවට බැලුම්ගල හැසිරෙන විදිහ ටිකක් විතර වැඩියිනම් තමයි. තමන් සියල්ලම දන්නවා වාගේ. හැබැයි,0
ඩෙසිකාගෙ බැල්ලි (බංගි) බිත්තර දානවලු,0
මු වගේ බුරැවෙක් උබෙි ඔක පණනැති වුනාම ගෑනි වෙන එකෙක් එක්ක යනවා යකෝ,1
හෙහ් හෙහ් හෙහ් හරි හරි හරි. ඔන්න ඔය චයිනිස් කෑල්ලට ට්‍රයි එකක් දීපන්. බැරිමනම් ගූග්ල් කරලා බලපන් මේකිගේ හොඳවයින් ෆොටෝ ටිකක් හොයාගත්තැකි. ඊට පස්සේ සුපුරුදු හස්ත කර්මාන්තය කරපන් එකෙක් සෙට්වෙනකම්.,0
පුක පෙන්නලා ෆොටො ගහන්න බෑ යාලු... කලුයි 😇😇😇😇,0
ගමයා උඹට බැරි වුණ දේ තව එකෙක් ගත්තම ඒකට සතුටු වෙයන්. මොකද හිතන්න එපා උගත්තු බිහි වෙන්නේ හැමදාම කොළමින් කියලා.,1
අබලන් බස්‍ රථ කියන්නේ අළුත් ඒවා ආවම එච්චරකල් දුවපුවටද​? සෙමි ලක්‍ෂරි කියලා ගෙනාපු බස් වලට දැන් මොකද වෙලා තියෙන්නේ? ඊට වඩා පරණ ලඩි දුවද්දි අවුරුද්දකට විතර පස්සේ සෙමියක් හොයාගන්නවත් නැත්තේ ඇයි? මේවාට මොකද උනේ කියලා ඩිපෝවල ඉන්න දන්න අඳුරන කෙනෙක්ගෙන් අහන්න නර්ස්ලා දන්නේ මොනවද කියලා මම කියන්න ඕනේ නෑනේ.,0
පුක 😂😂,0
ගමයා උඹට බැරි වුණ දේ තව එකෙක් ගත්තම ඒකට සතුටු වෙයන්. මොකද හිතන්න එපා උගත්තු බිහි වෙන්නේ හැමදාම කොළමින් කියලා.,1
මචෝ සේරම කාර්න්නේ බොරුව​. මගේනම් අදහස ජවිපේ හැමදාම විපක්‍ෂේ ඉන්න ඕනේ. නැත්නම් කෑගහන්න වැරදි පෙන්නන්නවත් එකෙක් නැති වෙනවා. ඊට වැඩි දෙයක් ජවිපෙන් බලාපොරොත්තු වෙන්න බෑ. උන්ගේ කියන ක්‍රම ප්‍රායෝගික නෑ. අනික එක පාරක් ඇමති කම් ටිකක් කලානේ. දැන් පේනවනේ විමලා පැන්නට පස්සේ හැසිරෙන විදිහ​. සේර්ම එකයි එළියෙදි එහෙමයි,0
හුත්තො ඒක 😂,1
ගමයා උඹට බැරි වුණ දේ තව එකෙක් ගත්තම ඒකට සතුටු වෙයන්. මොකද හිතන්න එපා උගත්තු බිහි වෙන්නේ හැමදාම කොළමින් කියලා.,1
හුටා ඔන්න ලංකවේ නම් නීතියෙන් තහනම්. ඉක්මනට ග්‍රීන් වීසවත් ඇප්ලයි කරපන්,0
ඕකම මට උනා එක පාරක් නුවර ගිහින් එද්දි,0
ගමයා උඹට බැරි වුණ දේ උන් දෙන්නා ගත්තම ජෙලස් වෙන්න එපා. හිතාගෙන ඉන්නේ කොළඹ විතරද බුද්ධිමත් කොල්ලෝ ඉන්නේ කියලද,1
ඇරියා නේද ගොසිපෝ. හෙක් හෙක් වචනයක් වරදින්න බෑ. ඔයකියල තියෙන්නේ අර තියෙන ගල උඩින් ගොඩ බැස්සුවා කියලා. ඒකවත් තේරුම් ගන්න බෑනේ. එහෙම ලොකු නැවක් ගොඩ බස්සපු හින්දා,0
අපෙන් වාසිම ගන්න අපිව ආස්සරය කරන අය ඉන්නවා.. ඉතින් ඒ කැරියෝ සහ කැරි යුවතියන් ව අපි ටික දවසකින් හලනවා. මෙන්න ඉන් පස්සේ උන් ස්ටේටස් දානවා.ඉස්සර වගේනෙමෙයි අපි වෙනස් වෙලා කියලා.. යකෝ.. අපිට චර්ම රෝග තියෙනවා..ඒත් ඔඩු දුවන්න කලින් බෙහෙත් ගන්නවා..හරිය..,1
මේකේ සිරාවට පොන්න වැඩ කරන උන් ටිකකුයි පර වැඩ කරන්න ගෑණු ටිකකුයි ඉන්නවා. 😅 ඒ වැඩ කරන උන් ටික දන්නවා මෙ උන්ට කියන්නේ කියලා. ප්ලීස් එහෙම නම් පුක නෝදී අන්ෆලෝ කරලා යනවද නොදන්න කේලම් ගොතන්නේ නැතිව ? මේක ඉල්ලීමක් විදිහට භාර ගන්නවට වඩා වෝනිං එකක් විදිහට බාරගත්තොත් තමයි හොඳ. 🙂,1
ඇති කරන්නට නැති කරන්නටද මාධ්‍ය මූලික වේ,0
නොනට පෙන්නුවනම' හොදයි,0
දැන් මේකයි ප්‍රශ්නය අපි භාණ්ඩයක් ගන්න අත්තිකාරමක් ලියමනකුත් ලියල දුන්න කියමුකෝ මනුස්සයෙකුට . පස්සෙ මොකක් හරි හේතුවක් නිසා ඒ බඩුව ගන්න බැරි තත්වයක් ආවම ඒ අත්තිකාරමකමින් කෙටෙසක් හරි ඉලලන්න බැරිද මිත්‍රවරුනි?,0
ගෑණු කියන්නේ සත්තු වගේ ජාතියක් තමයි මහත්තයා,1
පින් සිද්ධ වේවා,0
දැන් පොඩි එවුන් මහ තිත්ත පට්ට කුණුහර්පවලින්නෙ කතා කරන්නේ යකෝ!! මම කටක් ඇරලා පුක කියලා කිව්වෙත් අවුරුදු 21 පැන්නට පස්සෙ 😒 එතකල් කිව්වෙ පස්ස පැත්ත කියලා ඒකට 🤭,0
විහිළුවක් වෙන්න එපා මනුස්සයො...දැන් නම් මොළේ අමාරුව හොදටම වැඩියි වගේ...,1
මූ වගේ මෝඩ මූසලයෙක්.,1
දේශපාලනය ගැන ලොරි දෙන්න කලින් කවමදාවත් තමන් හරි තමන්ගේ දෙමවුපියන් නෑ හිතවතුන් හොරෙන් දේශපාලුවන්ගේ පුක පස්සේ ගිහින්/යවල කවමදාවත් රස්සා,1
දැන් ඉතින් කට්ටිය ඇල්ලුවද ? බණ එපා ඩෝ...,0
අඩේ හිරෙත් ඉන්නවනේ මනුස්සකම දන්නා උන්. හිරකාරයෝ මනුෂයෝය කියනේ ඇත්ත. මූට ගහල එල්ලන්න තිබ්බේ. පරයව.,1
කමක් නෑ,0
ලොකු එක නොදී පල ඩෝ...එහෙම එක එක දවස් වල කොහොමද සම්මුඛ පරීක්ෂණ කරන්නෙ...උඹ හිතුවද මේක තේ කඩයක් කියලා,1
ජෝතෂ්‍ය හරියට දන්නේ නැති මුන් වගේ එඋන් තමයි බූරුවෝ. එත් උන් හිතන් ඉන්නේ අසන්නෝ බූරුවෝ කියල. චන්ද්‍රසිරි බණ්ඩාර එකපාරක් ගුටි කාල මදි වෙලාද කොහෙද (ජනාධිපතිවරණෙ ගැන කියන්න ගිහින්). මුන් හින්දා අර පාරම්පරික ගණිත ශ්‍රාස්තයට කරන ජෝතිෂ්‍යයටත් නින්දාවෙනවා. හම්බ කර ගන්න බොරු දෙසාබානව.,1
දැන් පොඩි එවුන් මහ තිත්ත පට්ට කුණුහර්පවලින්නෙ කතා කරන්නේ යකෝ!! මම කටක් ඇරලා පුක කියලා කිව්වෙත් අවුරුදු 21 පැන්නට පස්සෙ 😒 එතකල් කිව්වෙ පස්ස පැත්ත කියලා ඒකට 🤭,0
මලක් ඇදන් ඉදහල්ලා බං....එතකොට හද පායයි හැමදාම...,0
දැන් තව මගුලක්. මම හිතුව නයා භාර දුන්නම ඉවරයි කියලා.,0
මව කරලා මසයක් කරපු කැරි බල්ලට කියන්නේ මගෙ උබලට දිරවන්නෙ නැත් නම් වෙලා පලයං මොන හුත්තකටද මගෙ එකේ ඉන්නේ මෙහෙම කිව්වට පස්සෙත් මගෙ එකේ ඉන්නවා නම් උබලගේ අම්මට හුකවල තියෙන්නේ පිට එකෙක් මං ගැන හොයන්න කලින් උබේ තාත්තා කව්ද කියලා හොයපං,1
බඩු කිව්වෙ...,0
මේකි අහිකුන්ටක ජනතාවගේ පොෂ් කෑල්ලක්ද කොහෙද. අම්මත් ඉන්දියානු කියනවනේ. (අපහාසයකට නෙවෙයි හැහ් ),0
අද සිරස ඉස්සරහට ගිහිල්ලා සංයමයෙන් විරෝධය දක්වපු විරෝධතා කරුවන්ට එරෙහි ව හාම්පුතාගේ පැත්තේ ඉඳන් බුරන හැම එකෙක් ම එක්කෝ කිලී මහරාජට බය එකෙක්.එහෙම නැත්නම් රස්සාවට පුක දෙන එකෙක්. මිනිස්සුන්ට පිහිටන ඍජු කශේරුකාවේ මුදුනේ සිරසක් නැති එකෙක්. අද ප්‍රොටෙස්ට් එකේ අභ්‍යන්තර අවුල් තියෙන්න,1
බලපත්‍ර‍ නැති උනත් ඌ කරන වැඩ එළ නම් එච්චරයිනෙ..ඔය කෑ ගහන උන්ට සදාචාරයක් තියෙනවද....මුන්ගෙ කටවල් ටික මහන්න තියෙන්නෙ අරින්න බැරි වෙන්න,0
ඉරාන ජාතික පෙම්වතා මුස්ලිම් ජාතිකයෙක්නම් ඉතින් සත්තුත් එක්ක ඉන්න බැරීවෙයි. මොකද කූරානෙට අනුව සත්තු අපිරිසිදුයි කියනවනේ.,0
එ බං අරු යනවා වරෙං කො යන්න උට ගහන්න ඔන බං අනේ අනේ අනේ යමන් කො එයි ඔබ මොකක්ද කියලා තියෙන්නෙ ඇ බොල කැරි€ හුක«» ගන්න හදන්නෙපා එපා පොන₹€¥ ඇයි යාළුවො එම ගහගන්න බැරිනම් මං වගේ පාඩුවෙ ඉන්න එපැයි හැමිනෙන්න යන්නෙ නැතිව😇 #18+චණ්ඩි 😂😂😂👉,1
ලොකු එක නොදී පල ගෙවලයා...,1
බලන් ගියාම මේකි ශ්‍රී ලාංකාවේත් නෙවෙයිද? මට මේ කෙල්ලගේ ජීවිතේම පිස්සුවක් වගේ......,0
අනේ හුකන්නෝ!!! ක්‍රිකට් ගහනව නම් ක්‍රිකට් ගහන් හිටපල්ලා පුක දීගෙන හැමිනෙන්නේ නැතුව... තොපේ අම්මගේ රෙද්ද... කලු සල්ලි කිව්ව ගමන් ට්‍රිගර් වෙන ගොන් පකයො ටිකක් දාගෙන ගහන මොන ක්‍රිකට් ද මේවා !,1
ආතල් කඩන එක කැතයි අප්පා...,0
සමහරෙකුට පුක ඌයියා වන සුළුයි. ප්‍රවේසමෙන් ගීතය රස විඳින්න. ෆැන්ටසියට ටසිරි වෙන්න දෙන රියැලිටිය. අහන්න යන පාර -,1
අයියෝ ලයිව් වගේ රෙකෝඩින් ගහන...උන් තරම් වැඩ්ඩො මුලු ලෝකෙම නෑ කියලා හිතන පීචං පජාත බෑන්ඩ් එකක්නෙ අප්පා...තණමල්විල මල් ගහපු මල්ලිලාට නම් මුන් හරි පොරවල් වෙන්න ඇති.....,1
කාලෝචිත වටින සොයා ගැනීමක්. ඔබට සුබ පැතුම්......!!!!!,0
මටත් තියනව බයික් හීනයක්:|✋ පොඩි කාලෙ ඉදන්ම මවපු ලොකුම ලොකු හීනයක්.එහෙමයි කියල යකඩ හීන යකඩ හීන කියාගෙන මේකෙ හැමනෙන්නෑ:|😹✋ මොකද අර ගෑනු පදින බයික් පදින උනුත් කියන්නෙ උන්ට තියන්නෙත් යකඩ හීනලු.හුත්තො...,1
බක්මී මල් වැටුන වැවෙන් නාපු බුවාද මේවා ගෙන්නුවෙ ?,0
